5, win 501, length 256
00:12:24.792567 IP ubuntu-s-1vcpu-1gb-intel-tor1-01.ssh > lnsm1-torontoxn-142-116-18-17.internet.virginmobile.ca.61135: Flags [P.], seq 7114904:7115124, ack 3745, win 501, length 220
00:12:24.792615 IP ubuntu-s-1vcpu-1gb-intel-tor1-01.ssh > lnsm1-torontoxn-142-116-18-17.internet.virginmobile.ca.61135: Flags [P.], seq 7115124:7115344, ack 3745, win 501, length 220
00:12:24.792650 IP ubuntu-s-1vcpu-1gb-intel-tor1-01.ssh > lnsm1-torontoxn-142-116-18-17.internet.virginmobile.ca.61135: Flags [P.], seq 7115344:7115600, ack 3745, win 501, length 256
00:12:24.792706 IP ubuntu-s-1vcpu-1gb-intel-tor1-01.ssh > lnsm1-torontoxn-142-116-18-17.internet.virginmobile.ca.61135: Flags [P.], seq 7115600:7115820, ack 3745, win 501, length 220
00:12:24.792749 IP ubuntu-s-1vcpu-1gb-intel-tor1-01.ssh > lnsm1-torontoxn-142-116-18-17.internet.virginmobile.ca.61135: Flags [P.], seq 7115820:7116040, ack 3745, win 501, length 220
00:12:24.792792 IP ubuntu-s-1vcpu-1gb-intel-tor1-01.ssh > lnsm1-torontoxn-142-116-18-17.internet.virginmobile.ca.61135: Flags [P.], seq 7116040:7116260, ack 3745, win 501, length 220
00:12:24.792825 IP ubuntu-s-1vcpu-1gb-intel-tor1-01.ssh > lnsm1-torontoxn-142-116-18-17.internet.virginmobile.ca.61135: Flags [P.], seq 7116260:7116516, ack 3745, win 501, length 256
00:12:24.792868 IP ubuntu-s-1vcpu-1gb-intel-tor1-01.ssh > lnsm1-torontoxn-142-116-18-17.internet.virginmobile.ca.61135: Flags [P.], seq 7116516:7116736, ack 3745, win 501, length 220
00:12:24.792905 IP ubuntu-s-1vcpu-1gb-intel-tor1-01.ssh > lnsm1-torontoxn-142-116-18-17.internet.virginmobile.ca.61135: Flags [P.], seq 7116736:7116992, ack 3745, win 501, length 256
00:12:24.792950 IP ubuntu-s-1vcpu-1gb-intel-tor1-01.ssh > lnsm1-torontoxn-142-116-18-17.internet.virginmobile.ca.61135: Flags [P.], seq 7116992:7117212, ack 3745, win 501, length 220
00:12:24.792986 IP ubuntu-s-1vcpu-1gb-intel-tor1-01.ssh > lnsm1-torontoxn-142-116-18-17.internet.virginmobile.ca.61135: Flags [P.], seq 7117212:7117468, ack 3745, win 501, length 256
00:12:24.793026 IP ubuntu-s-1vcpu-1gb-intel-tor1-01.ssh > lnsm1-torontoxn-142-116-18-17.internet.virginmobile.ca.61135: Flags [P.], seq 7117468:7117688, ack 3745, win 501, length 220
00:12:24.793068 IP ubuntu-s-1vcpu-1gb-intel-tor1-01.ssh > lnsm1-torontoxn-142-116-18-17.internet.virginmobile.ca.61135: Flags [P.], seq 7117688:7117908, ack 3745, win 501, length 220
00:12:24.793110 IP ubuntu-s-1vcpu-1gb-intel-tor1-01.ssh > lnsm1-torontoxn-142-116-18-17.internet.virginmobile.ca.61135: Flags [P.], seq 7117908:7118128, ack 3745, win 501, length 220
00:12:24.793152 IP ubuntu-s-1vcpu-1gb-intel-tor1-01.ssh > lnsm1-torontoxn-142-116-18-17.internet.virginmobile.ca.61135: Flags [P.], seq 7118128:7118348, ack 3745, win 501, length 220
00:12:24.793189 IP ubuntu-s-1vcpu-1gb-intel-tor1-01.ssh > lnsm1-torontoxn-142-116-18-17.internet.virginmobile.ca.61135: Flags [P.], seq 7118348:7118604, ack 3745, win 501, length 256
00:12:24.793212 IP lnsm1-torontoxn-142-116-18-17.internet.virginmobile.ca.61135 > ubuntu-s-1vcpu-1gb-intel-tor1-01.ssh: Flags [.], ack 7010108, win 483, length 0
00:12:24.793212 IP lnsm1-torontoxn-142-116-18-17.internet.virginmobile.ca.61135 > ubuntu-s-1vcpu-1gb-intel-tor1-01.ssh: Flags [.], ack 7011388, win 478, length 0
00:12:24.793212 IP lnsm1-torontoxn-142-116-18-17.internet.virginmobile.ca.61135 > ubuntu-s-1vcpu-1gb-intel-tor1-01.ssh: Flags [.], ack 7012156, win 475, length 0
00:12:24.793212 IP lnsm1-torontoxn-142-116-18-17.internet.virginmobile.ca.61135 > ubuntu-s-1vcpu-1gb-intel-tor1-01.ssh: Flags [.], ack 7012924, win 472, length 0
00:12:24.793212 IP lnsm1-torontoxn-142-116-18-17.internet.virginmobile.ca.61135 > ubuntu-s-1vcpu-1gb-intel-tor1-01.ssh: Flags [.], ack 7014204, win 467, length 0
00:12:24.793212 IP lnsm1-torontoxn-142-116-18-17.internet.virginmobile.ca.61135 > ubuntu-s-1vcpu-1gb-intel-tor1-01.ssh: Flags [.], ack 7016020, win 460, length 0
00:12:24.793253 IP ubuntu-s-1vcpu-1gb-intel-tor1-01.ssh > lnsm1-torontoxn-142-116-18-17.internet.virginmobile.ca.61135: Flags [P.], seq 7118604:7118992, ack 3745, win 501, length 388
00:12:24.793300 IP ubuntu-s-1vcpu-1gb-intel-tor1-01.ssh > lnsm1-torontoxn-142-116-18-17.internet.virginmobile.ca.61135: Flags [P.], seq 7118992:7119844, ack 3745, win 501, length 852
00:12:24.793341 IP ubuntu-s-1vcpu-1gb-intel-tor1-01.ssh > lnsm1-torontoxn-142-116-18-17.internet.virginmobile.ca.61135: Flags [P.], seq 7119844:7120248, ack 3745, win 501, length 404
00:12:24.793383 IP ubuntu-s-1vcpu-1gb-intel-tor1-01.ssh > lnsm1-torontoxn-142-116-18-17.internet.virginmobile.ca.61135: Flags [P.], seq 7120248:7120468, ack 3745, win 501, length 220
00:12:24.793417 IP ubuntu-s-1vcpu-1gb-intel-tor1-01.ssh > lnsm1-torontoxn-142-116-18-17.internet.virginmobile.ca.61135: Flags [P.], seq 7120468:7120724, ack 3745, win 501, length 256
00:12:24.793460 IP ubuntu-s-1vcpu-1gb-intel-tor1-01.ssh > lnsm1-torontoxn-142-116-18-17.internet.virginmobile.ca.61135: Flags [P.], seq 7120724:7120944, ack 3745, win 501, length 220
00:12:24.793492 IP ubuntu-s-1vcpu-1gb-intel-tor1-01.ssh > lnsm1-torontoxn-142-116-18-17.internet.virginmobile.ca.61135: Flags [P.], seq 7120944:7121200, ack 3745, win 501, length 256
00:12:24.793542 IP ubuntu-s-1vcpu-1gb-intel-tor1-01.ssh > lnsm1-torontoxn-142-116-18-17.internet.virginmobile.ca.61135: Flags [P.], seq 7121200:7121420, ack 3745, win 501, length 220
00:12:24.793579 IP ubuntu-s-1vcpu-1gb-intel-tor1-01.ssh > lnsm1-torontoxn-142-116-18-17.internet.virginmobile.ca.61135: Flags [P.], seq 7121420:7121676, ack 3745, win 501, length 256
00:12:24.793627 IP ubuntu-s-1vcpu-1gb-intel-tor1-01.ssh > lnsm1-torontoxn-142-116-18-17.internet.virginmobile.ca.61135: Flags [P.], seq 7121676:7121896, ack 3745, win 501, length 220
00:12:24.793660 IP ubuntu-s-1vcpu-1gb-intel-tor1-01.ssh > lnsm1-torontoxn-142-116-18-17.internet.virginmobile.ca.61135: Flags [P.], seq 7121896:7122152, ack 3745, win 501, length 256
00:12:24.793703 IP ubuntu-s-1vcpu-1gb-intel-tor1-01.ssh > lnsm1-torontoxn-142-116-18-17.internet.virginmobile.ca.61135: Flags [P.], seq 7122152:7122372, ack 3745, win 501, length 220
00:12:24.793740 IP ubuntu-s-1vcpu-1gb-intel-tor1-01.ssh > lnsm1-torontoxn-142-116-18-17.internet.virginmobile.ca.61135: Flags [P.], seq 7122372:7122628, ack 3745, win 501, length 256
00:12:24.793782 IP ubuntu-s-1vcpu-1gb-intel-tor1-01.ssh > lnsm1-torontoxn-142-116-18-17.internet.virginmobile.ca.61135: Flags [P.], seq 7122628:7122848, ack 3745, win 501, length 220
00:12:24.793824 IP ubuntu-s-1vcpu-1gb-intel-tor1-01.ssh > lnsm1-torontoxn-142-116-18-17.internet.virginmobile.ca.61135: Flags [P.], seq 7122848:7123068, ack 3745, win 501, length 220
00:12:24.793880 IP ubuntu-s-1vcpu-1gb-intel-tor1-01.ssh > lnsm1-torontoxn-142-116-18-17.internet.virginmobile.ca.61135: Flags [P.], seq 7123068:7123288, ack 3745, win 501, length 220
00:12:24.793915 IP ubuntu-s-1vcpu-1gb-intel-tor1-01.ssh > lnsm1-torontoxn-142-116-18-17.internet.virginmobile.ca.61135: Flags [P.], seq 7123288:7123544, ack 3745, win 501, length 256
00:12:24.793959 IP ubuntu-s-1vcpu-1gb-intel-tor1-01.ssh > lnsm1-torontoxn-142-116-18-17.internet.virginmobile.ca.61135: Flags [P.], seq 7123544:7123764, ack 3745, win 501, length 220
00:12:24.793986 IP ubuntu-s-1vcpu-1gb-intel-tor1-01.ssh > lnsm1-torontoxn-142-116-18-17.internet.virginmobile.ca.61135: Flags [P.], seq 7123764:7124020, ack 3745, win 501, length 256
00:12:24.794034 IP ubuntu-s-1vcpu-1gb-intel-tor1-01.ssh > lnsm1-torontoxn-142-116-18-17.internet.virginmobile.ca.61135: Flags [P.], seq 7124020:7124240, ack 3745, win 501, length 220
00:12:24.794077 IP ubuntu-s-1vcpu-1gb-intel-tor1-01.ssh > lnsm1-torontoxn-142-116-18-17.internet.virginmobile.ca.61135: Flags [P.], seq 7124240:7124460, ack 3745, win 501, length 220
00:12:24.794120 IP ubuntu-s-1vcpu-1gb-intel-tor1-01.ssh > lnsm1-torontoxn-142-116-18-17.internet.virginmobile.ca.61135: Flags [P.], seq 7124460:7124680, ack 3745, win 501, length 220
00:12:24.794153 IP ubuntu-s-1vcpu-1gb-intel-tor1-01.ssh > lnsm1-torontoxn-142-116-18-17.internet.virginmobile.ca.61135: Flags [P.], seq 7124680:7124936, ack 3745, win 501, length 256
00:12:24.794196 IP ubuntu-s-1vcpu-1gb-intel-tor1-01.ssh > lnsm1-torontoxn-142-116-18-17.internet.virginmobile.ca.61135: Flags [P.], seq 7124936:7125156, ack 3745, win 501, length 220
00:12:24.794210 IP lnsm1-torontoxn-142-116-18-17.internet.virginmobile.ca.61135 > ubuntu-s-1vcpu-1gb-intel-tor1-01.ssh: Flags [.], ack 7018664, win 449, length 0
00:12:24.794211 IP lnsm1-torontoxn-142-116-18-17.internet.virginmobile.ca.61135 > ubuntu-s-1vcpu-1gb-intel-tor1-01.ssh: Flags [.], ack 7019360, win 447, length 0
00:12:24.794250 IP ubuntu-s-1vcpu-1gb-intel-tor1-01.ssh > lnsm1-torontoxn-142-116-18-17.internet.virginmobile.ca.61135: Flags [P.], seq 7125156:7125704, ack 3745, win 501, length 548
00:12:24.794292 IP ubuntu-s-1vcpu-1gb-intel-tor1-01.ssh > lnsm1-torontoxn-142-116-18-17.internet.virginmobile.ca.61135: Flags [P.], seq 7125704:7125924, ack 3745, win 501, length 220
00:12:24.794334 IP ubuntu-s-1vcpu-1gb-intel-tor1-01.ssh > lnsm1-torontoxn-142-116-18-17.internet.virginmobile.ca.61135: Flags [P.], seq 7125924:7126144, ack 3745, win 501, length 220
00:12:24.794371 IP ubuntu-s-1vcpu-1gb-intel-tor1-01.ssh > lnsm1-torontoxn-142-116-18-17.internet.virginmobile.ca.61135: Flags [P.], seq 7126144:7126400, ack 3745, win 501, length 256
00:12:24.794417 IP ubuntu-s-1vcpu-1gb-intel-tor1-01.ssh > lnsm1-torontoxn-142-116-18-17.internet.virginmobile.ca.61135: Flags [P.], seq 7126400:7126620, ack 3745, win 501, length 220
00:12:24.794459 IP ubuntu-s-1vcpu-1gb-intel-tor1-01.ssh > lnsm1-torontoxn-142-116-18-17.internet.virginmobile.ca.61135: Flags [P.], seq 7126620:7126840, ack 3745, win 501, length 220
00:12:24.794500 IP ubuntu-s-1vcpu-1gb-intel-tor1-01.ssh > lnsm1-torontoxn-142-116-18-17.internet.virginmobile.ca.61135: Flags [P.], seq 7126840:7127060, ack 3745, win 501, length 220
00:12:24.794538 IP ubuntu-s-1vcpu-1gb-intel-tor1-01.ssh > lnsm1-torontoxn-142-116-18-17.internet.virginmobile.ca.61135: Flags [P.], seq 7127060:7127316, ack 3745, win 501, length 256
00:12:24.794581 IP ubuntu-s-1vcpu-1gb-intel-tor1-01.ssh > lnsm1-torontoxn-142-116-18-17.internet.virginmobile.ca.61135: Flags [P.], seq 7127316:7127536, ack 3745, win 501, length 220
00:12:24.794623 IP ubuntu-s-1vcpu-1gb-intel-tor1-01.ssh > lnsm1-torontoxn-142-116-18-17.internet.virginmobile.ca.61135: Flags [P.], seq 7127536:7127756, ack 3745, win 501, length 220
00:12:24.794656 IP ubuntu-s-1vcpu-1gb-intel-tor1-01.ssh > lnsm1-torontoxn-142-116-18-17.internet.virginmobile.ca.61135: Flags [P.], seq 7127756:7128012, ack 3745, win 501, length 256
00:12:24.794712 IP ubuntu-s-1vcpu-1gb-intel-tor1-01.ssh > lnsm1-torontoxn-142-116-18-17.internet.virginmobile.ca.61135: Flags [P.], seq 7128012:7128232, ack 3745, win 501, length 220
00:12:24.794755 IP ubuntu-s-1vcpu-1gb-intel-tor1-01.ssh > lnsm1-torontoxn-142-116-18-17.internet.virginmobile.ca.61135: Flags [P.], seq 7128232:7128452, ack 3745, win 501, length 220
00:12:24.794789 IP ubuntu-s-1vcpu-1gb-intel-tor1-01.ssh > lnsm1-torontoxn-142-116-18-17.internet.virginmobile.ca.61135: Flags [P.], seq 7128452:7128708, ack 3745, win 501, length 256
00:12:24.794831 IP ubuntu-s-1vcpu-1gb-intel-tor1-01.ssh > lnsm1-torontoxn-142-116-18-17.internet.virginmobile.ca.61135: Flags [P.], seq 7128708:7128928, ack 3745, win 501, length 220
00:12:24.794868 IP ubuntu-s-1vcpu-1gb-intel-tor1-01.ssh > lnsm1-torontoxn-142-116-18-17.internet.virginmobile.ca.61135: Flags [P.], seq 7128928:7129184, ack 3745, win 501, length 256
00:12:24.794910 IP ubuntu-s-1vcpu-1gb-intel-tor1-01.ssh > lnsm1-torontoxn-142-116-18-17.internet.virginmobile.ca.61135: Flags [P.], seq 7129184:7129404, ack 3745, win 501, length 220
00:12:24.794952 IP ubuntu-s-1vcpu-1gb-intel-tor1-01.ssh > lnsm1-torontoxn-142-116-18-17.internet.virginmobile.ca.61135: Flags [P.], seq 7129404:7129624, ack 3745, win 501, length 220
00:12:24.794994 IP ubuntu-s-1vcpu-1gb-intel-tor1-01.ssh > lnsm1-torontoxn-142-116-18-17.internet.virginmobile.ca.61135: Flags [P.], seq 7129624:7129844, ack 3745, win 501, length 220
00:12:24.795032 IP ubuntu-s-1vcpu-1gb-intel-tor1-01.ssh > lnsm1-torontoxn-142-116-18-17.internet.virginmobile.ca.61135: Flags [P.], seq 7129844:7130100, ack 3745, win 501, length 256
00:12:24.795076 IP ubuntu-s-1vcpu-1gb-intel-tor1-01.ssh > lnsm1-torontoxn-142-116-18-17.internet.virginmobile.ca.61135: Flags [P.], seq 7130100:7130320, ack 3745, win 501, length 220
00:12:24.795119 IP ubuntu-s-1vcpu-1gb-intel-tor1-01.ssh > lnsm1-torontoxn-142-116-18-17.internet.virginmobile.ca.61135: Flags [P.], seq 7130320:7130540, ack 3745, win 501, length 220
00:12:24.795161 IP ubuntu-s-1vcpu-1gb-intel-tor1-01.ssh > lnsm1-torontoxn-142-116-18-17.internet.virginmobile.ca.61135: Flags [P.], seq 7130540:7130760, ack 3745, win 501, length 220
00:12:24.795198 IP ubuntu-s-1vcpu-1gb-intel-tor1-01.ssh > lnsm1-torontoxn-142-116-18-17.internet.virginmobile.ca.61135: Flags [P.], seq 7130760:7131016, ack 3745, win 501, length 256
00:12:24.795241 IP ubuntu-s-1vcpu-1gb-intel-tor1-01.ssh > lnsm1-torontoxn-142-116-18-17.internet.virginmobile.ca.61135: Flags [P.], seq 7131016:7131236, ack 3745, win 501, length 220
00:12:24.795284 IP ubuntu-s-1vcpu-1gb-intel-tor1-01.ssh > lnsm1-torontoxn-142-116-18-17.internet.virginmobile.ca.61135: Flags [P.], seq 7131236:7131456, ack 3745, win 501, length 220
00:12:24.795332 IP ubuntu-s-1vcpu-1gb-intel-tor1-01.ssh > lnsm1-torontoxn-142-116-18-17.internet.virginmobile.ca.61135: Flags [P.], seq 7131456:7131676, ack 3745, win 501, length 220
00:12:24.795369 IP ubuntu-s-1vcpu-1gb-intel-tor1-01.ssh > lnsm1-torontoxn-142-116-18-17.internet.virginmobile.ca.61135: Flags [P.], seq 7131676:7131932, ack 3745, win 501, length 256
00:12:24.795409 IP ubuntu-s-1vcpu-1gb-intel-tor1-01.ssh > lnsm1-torontoxn-142-116-18-17.internet.virginmobile.ca.61135: Flags [P.], seq 7131932:7132152, ack 3745, win 501, length 220
00:12:24.795443 IP ubuntu-s-1vcpu-1gb-intel-tor1-01.ssh > lnsm1-torontoxn-142-116-18-17.internet.virginmobile.ca.61135: Flags [P.], seq 7132152:7132408, ack 3745, win 501, length 256
00:12:24.795484 IP ubuntu-s-1vcpu-1gb-intel-tor1-01.ssh > lnsm1-torontoxn-142-116-18-17.internet.virginmobile.ca.61135: Flags [P.], seq 7132408:7132628, ack 3745, win 501, length 220
00:12:24.795526 IP ubuntu-s-1vcpu-1gb-intel-tor1-01.ssh > lnsm1-torontoxn-142-116-18-17.internet.virginmobile.ca.61135: Flags [P.], seq 7132628:7132848, ack 3745, win 501, length 220
00:12:24.795564 IP ubuntu-s-1vcpu-1gb-intel-tor1-01.ssh > lnsm1-torontoxn-142-116-18-17.internet.virginmobile.ca.61135: Flags [P.], seq 7132848:7133104, ack 3745, win 501, length 256
00:12:24.795609 IP ubuntu-s-1vcpu-1gb-intel-tor1-01.ssh > lnsm1-torontoxn-142-116-18-17.internet.virginmobile.ca.61135: Flags [P.], seq 7133104:7133324, ack 3745, win 501, length 220
00:12:24.795650 IP ubuntu-s-1vcpu-1gb-intel-tor1-01.ssh > lnsm1-torontoxn-142-116-18-17.internet.virginmobile.ca.61135: Flags [P.], seq 7133324:7133544, ack 3745, win 501, length 220
00:12:24.795693 IP ubuntu-s-1vcpu-1gb-intel-tor1-01.ssh > lnsm1-torontoxn-142-116-18-17.internet.virginmobile.ca.61135: Flags [P.], seq 7133544:7133764, ack 3745, win 501, length 220
00:12:24.798256 IP lnsm1-torontoxn-142-116-18-17.internet.virginmobile.ca.61135 > ubuntu-s-1vcpu-1gb-intel-tor1-01.ssh: Flags [.], ack 7023888, win 429, length 0
00:12:24.798256 IP lnsm1-torontoxn-142-116-18-17.internet.virginmobile.ca.61135 > ubuntu-s-1vcpu-1gb-intel-tor1-01.ssh: Flags [.], ack 7026792, win 418, length 0
00:12:24.798256 IP lnsm1-torontoxn-142-116-18-17.internet.virginmobile.ca.61135 > ubuntu-s-1vcpu-1gb-intel-tor1-01.ssh: Flags [.], ack 7031488, win 399, length 0
00:12:24.798256 IP lnsm1-torontoxn-142-116-18-17.internet.virginmobile.ca.61135 > ubuntu-s-1vcpu-1gb-intel-tor1-01.ssh: Flags [.], ack 7032588, win 395, length 0
00:12:24.798256 IP lnsm1-torontoxn-142-116-18-17.internet.virginmobile.ca.61135 > ubuntu-s-1vcpu-1gb-intel-tor1-01.ssh: Flags [.], ack 7032808, win 394, length 0
00:12:24.800093 IP lnsm1-torontoxn-142-116-18-17.internet.virginmobile.ca.61135 > ubuntu-s-1vcpu-1gb-intel-tor1-01.ssh: Flags [.], ack 7033504, win 391, length 0
00:12:24.800093 IP lnsm1-torontoxn-142-116-18-17.internet.virginmobile.ca.61135 > ubuntu-s-1vcpu-1gb-intel-tor1-01.ssh: Flags [.], ack 7036032, win 381, length 0
00:12:24.800093 IP lnsm1-torontoxn-142-116-18-17.internet.virginmobile.ca.61135 > ubuntu-s-1vcpu-1gb-intel-tor1-01.ssh: Flags [.], ack 7037168, win 377, length 0
00:12:24.804223 IP lnsm1-torontoxn-142-116-18-17.internet.virginmobile.ca.61135 > ubuntu-s-1vcpu-1gb-intel-tor1-01.ssh: Flags [.], ack 7038488, win 372, length 0
00:12:24.804224 IP lnsm1-torontoxn-142-116-18-17.internet.virginmobile.ca.61135 > ubuntu-s-1vcpu-1gb-intel-tor1-01.ssh: Flags [.], ack 7039844, win 367, length 0
00:12:24.804224 IP lnsm1-torontoxn-142-116-18-17.internet.virginmobile.ca.61135 > ubuntu-s-1vcpu-1gb-intel-tor1-01.ssh: Flags [.], ack 7040760, win 363, length 0
00:12:24.804224 IP lnsm1-torontoxn-142-116-18-17.internet.virginmobile.ca.61135 > ubuntu-s-1vcpu-1gb-intel-tor1-01.ssh: Flags [.], ack 7041896, win 359, length 0
00:12:24.804224 IP lnsm1-torontoxn-142-116-18-17.internet.virginmobile.ca.61135 > ubuntu-s-1vcpu-1gb-intel-tor1-01.ssh: Flags [.], ack 7041896, win 521, length 0
00:12:24.804224 IP lnsm1-torontoxn-142-116-18-17.internet.virginmobile.ca.61135 > ubuntu-s-1vcpu-1gb-intel-tor1-01.ssh: Flags [.], ack 7045144, win 521, length 0
00:12:24.804224 IP lnsm1-torontoxn-142-116-18-17.internet.virginmobile.ca.61135 > ubuntu-s-1vcpu-1gb-intel-tor1-01.ssh: Flags [.], ack 7050040, win 521, length 0
00:12:24.804272 IP ubuntu-s-1vcpu-1gb-intel-tor1-01.ssh > lnsm1-torontoxn-142-116-18-17.internet.virginmobile.ca.61135: Flags [P.], seq 7133764:7135848, ack 3745, win 501, length 2084
00:12:24.804428 IP ubuntu-s-1vcpu-1gb-intel-tor1-01.ssh > lnsm1-torontoxn-142-116-18-17.internet.virginmobile.ca.61135: Flags [P.], seq 7135848:7136312, ack 3745, win 501, length 464
00:12:24.804479 IP ubuntu-s-1vcpu-1gb-intel-tor1-01.ssh > lnsm1-torontoxn-142-116-18-17.internet.virginmobile.ca.61135: Flags [P.], seq 7136312:7136740, ack 3745, win 501, length 428
00:12:24.804524 IP ubuntu-s-1vcpu-1gb-intel-tor1-01.ssh > lnsm1-torontoxn-142-116-18-17.internet.virginmobile.ca.61135: Flags [P.], seq 7136740:7137008, ack 3745, win 501, length 268
00:12:24.804559 IP ubuntu-s-1vcpu-1gb-intel-tor1-01.ssh > lnsm1-torontoxn-142-116-18-17.internet.virginmobile.ca.61135: Flags [P.], seq 7137008:7137436, ack 3745, win 501, length 428
00:12:24.804600 IP ubuntu-s-1vcpu-1gb-intel-tor1-01.ssh > lnsm1-torontoxn-142-116-18-17.internet.virginmobile.ca.61135: Flags [P.], seq 7137436:7137472, ack 3745, win 501, length 36
00:12:24.804607 IP ubuntu-s-1vcpu-1gb-intel-tor1-01.ssh > lnsm1-torontoxn-142-116-18-17.internet.virginmobile.ca.61135: Flags [P.], seq 7137472:7137692, ack 3745, win 501, length 220
00:12:24.804642 IP ubuntu-s-1vcpu-1gb-intel-tor1-01.ssh > lnsm1-torontoxn-142-116-18-17.internet.virginmobile.ca.61135: Flags [P.], seq 7137692:7137948, ack 3745, win 501, length 256
00:12:24.804675 IP ubuntu-s-1vcpu-1gb-intel-tor1-01.ssh > lnsm1-torontoxn-142-116-18-17.internet.virginmobile.ca.61135: Flags [P.], seq 7137948:7138204, ack 3745, win 501, length 256
00:12:24.804708 IP ubuntu-s-1vcpu-1gb-intel-tor1-01.ssh > lnsm1-torontoxn-142-116-18-17.internet.virginmobile.ca.61135: Flags [P.], seq 7138204:7138460, ack 3745, win 501, length 256
00:12:24.804741 IP ubuntu-s-1vcpu-1gb-intel-tor1-01.ssh > lnsm1-torontoxn-142-116-18-17.internet.virginmobile.ca.61135: Flags [P.], seq 7138460:7138680, ack 3745, win 501, length 220
00:12:24.804776 IP ubuntu-s-1vcpu-1gb-intel-tor1-01.ssh > lnsm1-torontoxn-142-116-18-17.internet.virginmobile.ca.61135: Flags [P.], seq 7138680:7139268, ack 3745, win 501, length 588
00:12:24.804808 IP ubuntu-s-1vcpu-1gb-intel-tor1-01.ssh > lnsm1-torontoxn-142-116-18-17.internet.virginmobile.ca.61135: Flags [P.], seq 7139268:7140040, ack 3745, win 501, length 772
00:12:24.804846 IP ubuntu-s-1vcpu-1gb-intel-tor1-01.ssh > lnsm1-torontoxn-142-116-18-17.internet.virginmobile.ca.61135: Flags [P.], seq 7140040:7140260, ack 3745, win 501, length 220
00:12:24.804875 IP ubuntu-s-1vcpu-1gb-intel-tor1-01.ssh > lnsm1-torontoxn-142-116-18-17.internet.virginmobile.ca.61135: Flags [P.], seq 7140260:7140480, ack 3745, win 501, length 220
00:12:24.804907 IP ubuntu-s-1vcpu-1gb-intel-tor1-01.ssh > lnsm1-torontoxn-142-116-18-17.internet.virginmobile.ca.61135: Flags [P.], seq 7140480:7140700, ack 3745, win 501, length 220
00:12:24.804957 IP ubuntu-s-1vcpu-1gb-intel-tor1-01.ssh > lnsm1-torontoxn-142-116-18-17.internet.virginmobile.ca.61135: Flags [P.], seq 7140700:7140956, ack 3745, win 501, length 256
00:12:24.805009 IP ubuntu-s-1vcpu-1gb-intel-tor1-01.ssh > lnsm1-torontoxn-142-116-18-17.internet.virginmobile.ca.61135: Flags [P.], seq 7140956:7141176, ack 3745, win 501, length 220
00:12:24.805051 IP ubuntu-s-1vcpu-1gb-intel-tor1-01.ssh > lnsm1-torontoxn-142-116-18-17.internet.virginmobile.ca.61135: Flags [P.], seq 7141176:7141396, ack 3745, win 501, length 220
00:12:24.805085 IP ubuntu-s-1vcpu-1gb-intel-tor1-01.ssh > lnsm1-torontoxn-142-116-18-17.internet.virginmobile.ca.61135: Flags [P.], seq 7141396:7141652, ack 3745, win 501, length 256
00:12:24.805126 IP ubuntu-s-1vcpu-1gb-intel-tor1-01.ssh > lnsm1-torontoxn-142-116-18-17.internet.virginmobile.ca.61135: Flags [P.], seq 7141652:7141872, ack 3745, win 501, length 220
00:12:24.805169 IP ubuntu-s-1vcpu-1gb-intel-tor1-01.ssh > lnsm1-torontoxn-142-116-18-17.internet.virginmobile.ca.61135: Flags [P.], seq 7141872:7142092, ack 3745, win 501, length 220
00:12:24.805212 IP ubuntu-s-1vcpu-1gb-intel-tor1-01.ssh > lnsm1-torontoxn-142-116-18-17.internet.virginmobile.ca.61135: Flags [P.], seq 7142092:7142312, ack 3745, win 501, length 220
00:12:24.805243 IP ubuntu-s-1vcpu-1gb-intel-tor1-01.ssh > lnsm1-torontoxn-142-116-18-17.internet.virginmobile.ca.61135: Flags [P.], seq 7142312:7142568, ack 3745, win 501, length 256
00:12:24.805305 IP ubuntu-s-1vcpu-1gb-intel-tor1-01.ssh > lnsm1-torontoxn-142-116-18-17.internet.virginmobile.ca.61135: Flags [P.], seq 7142568:7142788, ack 3745, win 501, length 220
00:12:24.805356 IP ubuntu-s-1vcpu-1gb-intel-tor1-01.ssh > lnsm1-torontoxn-142-116-18-17.internet.virginmobile.ca.61135: Flags [P.], seq 7142788:7143008, ack 3745, win 501, length 220
00:12:24.805399 IP ubuntu-s-1vcpu-1gb-intel-tor1-01.ssh > lnsm1-torontoxn-142-116-18-17.internet.virginmobile.ca.61135: Flags [P.], seq 7143008:7143228, ack 3745, win 501, length 220
00:12:24.805426 IP ubuntu-s-1vcpu-1gb-intel-tor1-01.ssh > lnsm1-torontoxn-142-116-18-17.internet.virginmobile.ca.61135: Flags [P.], seq 7143228:7143484, ack 3745, win 501, length 256
00:12:24.805488 IP ubuntu-s-1vcpu-1gb-intel-tor1-01.ssh > lnsm1-torontoxn-142-116-18-17.internet.virginmobile.ca.61135: Flags [P.], seq 7143484:7143704, ack 3745, win 501, length 220
00:12:24.805537 IP ubuntu-s-1vcpu-1gb-intel-tor1-01.ssh > lnsm1-torontoxn-142-116-18-17.internet.virginmobile.ca.61135: Flags [P.], seq 7143704:7143924, ack 3745, win 501, length 220
00:12:24.805579 IP ubuntu-s-1vcpu-1gb-intel-tor1-01.ssh > lnsm1-torontoxn-142-116-18-17.internet.virginmobile.ca.61135: Flags [P.], seq 7143924:7144144, ack 3745, win 501, length 220
00:12:24.805626 IP ubuntu-s-1vcpu-1gb-intel-tor1-01.ssh > lnsm1-torontoxn-142-116-18-17.internet.virginmobile.ca.61135: Flags [P.], seq 7144144:7144364, ack 3745, win 501, length 220
00:12:24.805675 IP ubuntu-s-1vcpu-1gb-intel-tor1-01.ssh > lnsm1-torontoxn-142-116-18-17.internet.virginmobile.ca.61135: Flags [P.], seq 7144364:7144584, ack 3745, win 501, length 220
00:12:24.805709 IP ubuntu-s-1vcpu-1gb-intel-tor1-01.ssh > lnsm1-torontoxn-142-116-18-17.internet.virginmobile.ca.61135: Flags [P.], seq 7144584:7144840, ack 3745, win 501, length 256
00:12:24.805757 IP ubuntu-s-1vcpu-1gb-intel-tor1-01.ssh > lnsm1-torontoxn-142-116-18-17.internet.virginmobile.ca.61135: Flags [P.], seq 7144840:7145060, ack 3745, win 501, length 220
00:12:24.805791 IP ubuntu-s-1vcpu-1gb-intel-tor1-01.ssh > lnsm1-torontoxn-142-116-18-17.internet.virginmobile.ca.61135: Flags [P.], seq 7145060:7145316, ack 3745, win 501, length 256
00:12:24.805832 IP ubuntu-s-1vcpu-1gb-intel-tor1-01.ssh > lnsm1-torontoxn-142-116-18-17.internet.virginmobile.ca.61135: Flags [P.], seq 7145316:7145536, ack 3745, win 501, length 220
00:12:24.805881 IP ubuntu-s-1vcpu-1gb-intel-tor1-01.ssh > lnsm1-torontoxn-142-116-18-17.internet.virginmobile.ca.61135: Flags [P.], seq 7145536:7145756, ack 3745, win 501, length 220
00:12:24.805924 IP ubuntu-s-1vcpu-1gb-intel-tor1-01.ssh > lnsm1-torontoxn-142-116-18-17.internet.virginmobile.ca.61135: Flags [P.], seq 7145756:7145976, ack 3745, win 501, length 220
00:12:24.805962 IP ubuntu-s-1vcpu-1gb-intel-tor1-01.ssh > lnsm1-torontoxn-142-116-18-17.internet.virginmobile.ca.61135: Flags [P.], seq 7145976:7146232, ack 3745, win 501, length 256
00:12:24.806003 IP ubuntu-s-1vcpu-1gb-intel-tor1-01.ssh > lnsm1-torontoxn-142-116-18-17.internet.virginmobile.ca.61135: Flags [P.], seq 7146232:7146452, ack 3745, win 501, length 220
00:12:24.806045 IP ubuntu-s-1vcpu-1gb-intel-tor1-01.ssh > lnsm1-torontoxn-142-116-18-17.internet.virginmobile.ca.61135: Flags [P.], seq 7146452:7146672, ack 3745, win 501, length 220
00:12:24.806078 IP ubuntu-s-1vcpu-1gb-intel-tor1-01.ssh > lnsm1-torontoxn-142-116-18-17.internet.virginmobile.ca.61135: Flags [P.], seq 7146672:7146928, ack 3745, win 501, length 256
00:12:24.806122 IP ubuntu-s-1vcpu-1gb-intel-tor1-01.ssh > lnsm1-torontoxn-142-116-18-17.internet.virginmobile.ca.61135: Flags [P.], seq 7146928:7147148, ack 3745, win 501, length 220
00:12:24.806159 IP ubuntu-s-1vcpu-1gb-intel-tor1-01.ssh > lnsm1-torontoxn-142-116-18-17.internet.virginmobile.ca.61135: Flags [P.], seq 7147148:7147404, ack 3745, win 501, length 256
00:12:24.806200 IP ubuntu-s-1vcpu-1gb-intel-tor1-01.ssh > lnsm1-torontoxn-142-116-18-17.internet.virginmobile.ca.61135: Flags [P.], seq 7147404:7147624, ack 3745, win 501, length 220
00:12:24.806217 IP lnsm1-torontoxn-142-116-18-17.internet.virginmobile.ca.61135 > ubuntu-s-1vcpu-1gb-intel-tor1-01.ssh: Flags [.], ack 7050920, win 518, length 0
00:12:24.806217 IP lnsm1-torontoxn-142-116-18-17.internet.virginmobile.ca.61135 > ubuntu-s-1vcpu-1gb-intel-tor1-01.ssh: Flags [.], ack 7052752, win 521, length 0
00:12:24.806217 IP lnsm1-torontoxn-142-116-18-17.internet.virginmobile.ca.61135 > ubuntu-s-1vcpu-1gb-intel-tor1-01.ssh: Flags [.], ack 7053888, win 517, length 0
00:12:24.806218 IP lnsm1-torontoxn-142-116-18-17.internet.virginmobile.ca.61135 > ubuntu-s-1vcpu-1gb-intel-tor1-01.ssh: Flags [.], ack 7056380, win 521, length 0
00:12:24.806258 IP ubuntu-s-1vcpu-1gb-intel-tor1-01.ssh > lnsm1-torontoxn-142-116-18-17.internet.virginmobile.ca.61135: Flags [P.], seq 7147624:7147844, ack 3745, win 501, length 220
00:12:24.806287 IP ubuntu-s-1vcpu-1gb-intel-tor1-01.ssh > lnsm1-torontoxn-142-116-18-17.internet.virginmobile.ca.61135: Flags [P.], seq 7147844:7148076, ack 3745, win 501, length 232
00:12:24.806337 IP ubuntu-s-1vcpu-1gb-intel-tor1-01.ssh > lnsm1-torontoxn-142-116-18-17.internet.virginmobile.ca.61135: Flags [P.], seq 7148076:7148280, ack 3745, win 501, length 204
00:12:24.806348 IP ubuntu-s-1vcpu-1gb-intel-tor1-01.ssh > lnsm1-torontoxn-142-116-18-17.internet.virginmobile.ca.61135: Flags [P.], seq 7148280:7148644, ack 3745, win 501, length 364
00:12:24.806393 IP ubuntu-s-1vcpu-1gb-intel-tor1-01.ssh > lnsm1-torontoxn-142-116-18-17.internet.virginmobile.ca.61135: Flags [P.], seq 7148644:7149416, ack 3745, win 501, length 772
00:12:24.806425 IP ubuntu-s-1vcpu-1gb-intel-tor1-01.ssh > lnsm1-torontoxn-142-116-18-17.internet.virginmobile.ca.61135: Flags [P.], seq 7149416:7149636, ack 3745, win 501, length 220
00:12:24.806464 IP ubuntu-s-1vcpu-1gb-intel-tor1-01.ssh > lnsm1-torontoxn-142-116-18-17.internet.virginmobile.ca.61135: Flags [P.], seq 7149636:7149856, ack 3745, win 501, length 220
00:12:24.806506 IP ubuntu-s-1vcpu-1gb-intel-tor1-01.ssh > lnsm1-torontoxn-142-116-18-17.internet.virginmobile.ca.61135: Flags [P.], seq 7149856:7150076, ack 3745, win 501, length 220
00:12:24.806540 IP ubuntu-s-1vcpu-1gb-intel-tor1-01.ssh > lnsm1-torontoxn-142-116-18-17.internet.virginmobile.ca.61135: Flags [P.], seq 7150076:7150296, ack 3745, win 501, length 220
00:12:24.806576 IP ubuntu-s-1vcpu-1gb-intel-tor1-01.ssh > lnsm1-torontoxn-142-116-18-17.internet.virginmobile.ca.61135: Flags [P.], seq 7150296:7150516, ack 3745, win 501, length 220
00:12:24.806608 IP ubuntu-s-1vcpu-1gb-intel-tor1-01.ssh > lnsm1-torontoxn-142-116-18-17.internet.virginmobile.ca.61135: Flags [P.], seq 7150516:7150772, ack 3745, win 501, length 256
00:12:24.806640 IP ubuntu-s-1vcpu-1gb-intel-tor1-01.ssh > lnsm1-torontoxn-142-116-18-17.internet.virginmobile.ca.61135: Flags [P.], seq 7150772:7150992, ack 3745, win 501, length 220
00:12:24.806674 IP ubuntu-s-1vcpu-1gb-intel-tor1-01.ssh > lnsm1-torontoxn-142-116-18-17.internet.virginmobile.ca.61135: Flags [P.], seq 7150992:7151212, ack 3745, win 501, length 220
00:12:24.806710 IP ubuntu-s-1vcpu-1gb-intel-tor1-01.ssh > lnsm1-torontoxn-142-116-18-17.internet.virginmobile.ca.61135: Flags [P.], seq 7151212:7151432, ack 3745, win 501, length 220
00:12:24.806749 IP ubuntu-s-1vcpu-1gb-intel-tor1-01.ssh > lnsm1-torontoxn-142-116-18-17.internet.virginmobile.ca.61135: Flags [P.], seq 7151432:7151652, ack 3745, win 501, length 220
00:12:24.806788 IP ubuntu-s-1vcpu-1gb-intel-tor1-01.ssh > lnsm1-torontoxn-142-116-18-17.internet.virginmobile.ca.61135: Flags [P.], seq 7151652:7151872, ack 3745, win 501, length 220
00:12:24.806823 IP ubuntu-s-1vcpu-1gb-intel-tor1-01.ssh > lnsm1-torontoxn-142-116-18-17.internet.virginmobile.ca.61135: Flags [P.], seq 7151872:7152128, ack 3745, win 501, length 256
00:12:24.806856 IP ubuntu-s-1vcpu-1gb-intel-tor1-01.ssh > lnsm1-torontoxn-142-116-18-17.internet.virginmobile.ca.61135: Flags [P.], seq 7152128:7152348, ack 3745, win 501, length 220
00:12:24.806892 IP ubuntu-s-1vcpu-1gb-intel-tor1-01.ssh > lnsm1-torontoxn-142-116-18-17.internet.virginmobile.ca.61135: Flags [P.], seq 7152348:7152568, ack 3745, win 501, length 220
00:12:24.806924 IP ubuntu-s-1vcpu-1gb-intel-tor1-01.ssh > lnsm1-torontoxn-142-116-18-17.internet.virginmobile.ca.61135: Flags [P.], seq 7152568:7152788, ack 3745, win 501, length 220
00:12:24.806959 IP ubuntu-s-1vcpu-1gb-intel-tor1-01.ssh > lnsm1-torontoxn-142-116-18-17.internet.virginmobile.ca.61135: Flags [P.], seq 7152788:7153044, ack 3745, win 501, length 256
00:12:24.806995 IP ubuntu-s-1vcpu-1gb-intel-tor1-01.ssh > lnsm1-torontoxn-142-116-18-17.internet.virginmobile.ca.61135: Flags [P.], seq 7153044:7153264, ack 3745, win 501, length 220
00:12:24.807028 IP ubuntu-s-1vcpu-1gb-intel-tor1-01.ssh > lnsm1-torontoxn-142-116-18-17.internet.virginmobile.ca.61135: Flags [P.], seq 7153264:7153484, ack 3745, win 501, length 220
00:12:24.807062 IP ubuntu-s-1vcpu-1gb-intel-tor1-01.ssh > lnsm1-torontoxn-142-116-18-17.internet.virginmobile.ca.61135: Flags [P.], seq 7153484:7153704, ack 3745, win 501, length 220
00:12:24.807095 IP ubuntu-s-1vcpu-1gb-intel-tor1-01.ssh > lnsm1-torontoxn-142-116-18-17.internet.virginmobile.ca.61135: Flags [P.], seq 7153704:7153960, ack 3745, win 501, length 256
00:12:24.807131 IP ubuntu-s-1vcpu-1gb-intel-tor1-01.ssh > lnsm1-torontoxn-142-116-18-17.internet.virginmobile.ca.61135: Flags [P.], seq 7153960:7154180, ack 3745, win 501, length 220
00:12:24.807163 IP ubuntu-s-1vcpu-1gb-intel-tor1-01.ssh > lnsm1-torontoxn-142-116-18-17.internet.virginmobile.ca.61135: Flags [P.], seq 7154180:7154400, ack 3745, win 501, length 220
00:12:24.807197 IP ubuntu-s-1vcpu-1gb-intel-tor1-01.ssh > lnsm1-torontoxn-142-116-18-17.internet.virginmobile.ca.61135: Flags [P.], seq 7154400:7154620, ack 3745, win 501, length 220
00:12:24.807232 IP ubuntu-s-1vcpu-1gb-intel-tor1-01.ssh > lnsm1-torontoxn-142-116-18-17.internet.virginmobile.ca.61135: Flags [P.], seq 7154620:7154876, ack 3745, win 501, length 256
00:12:24.807263 IP ubuntu-s-1vcpu-1gb-intel-tor1-01.ssh > lnsm1-torontoxn-142-116-18-17.internet.virginmobile.ca.61135: Flags [P.], seq 7154876:7155096, ack 3745, win 501, length 220
00:12:24.807296 IP ubuntu-s-1vcpu-1gb-intel-tor1-01.ssh > lnsm1-torontoxn-142-116-18-17.internet.virginmobile.ca.61135: Flags [P.], seq 7155096:7155316, ack 3745, win 501, length 220
00:12:24.807328 IP ubuntu-s-1vcpu-1gb-intel-tor1-01.ssh > lnsm1-torontoxn-142-116-18-17.internet.virginmobile.ca.61135: Flags [P.], seq 7155316:7155536, ack 3745, win 501, length 220
00:12:24.807365 IP ubuntu-s-1vcpu-1gb-intel-tor1-01.ssh > lnsm1-torontoxn-142-116-18-17.internet.virginmobile.ca.61135: Flags [P.], seq 7155536:7155756, ack 3745, win 501, length 220
00:12:24.807396 IP ubuntu-s-1vcpu-1gb-intel-tor1-01.ssh > lnsm1-torontoxn-142-116-18-17.internet.virginmobile.ca.61135: Flags [P.], seq 7155756:7155976, ack 3745, win 501, length 220
00:12:24.807429 IP ubuntu-s-1vcpu-1gb-intel-tor1-01.ssh > lnsm1-torontoxn-142-116-18-17.internet.virginmobile.ca.61135: Flags [P.], seq 7155976:7156232, ack 3745, win 501, length 256
00:12:24.807463 IP ubuntu-s-1vcpu-1gb-intel-tor1-01.ssh > lnsm1-torontoxn-142-116-18-17.internet.virginmobile.ca.61135: Flags [P.], seq 7156232:7156452, ack 3745, win 501, length 220
00:12:24.807501 IP ubuntu-s-1vcpu-1gb-intel-tor1-01.ssh > lnsm1-torontoxn-142-116-18-17.internet.virginmobile.ca.61135: Flags [P.], seq 7156452:7156672, ack 3745, win 501, length 220
00:12:24.807529 IP ubuntu-s-1vcpu-1gb-intel-tor1-01.ssh > lnsm1-torontoxn-142-116-18-17.internet.virginmobile.ca.61135: Flags [P.], seq 7156672:7156708, ack 3745, win 501, length 36
00:12:24.807562 IP ubuntu-s-1vcpu-1gb-intel-tor1-01.ssh > lnsm1-torontoxn-142-116-18-17.internet.virginmobile.ca.61135: Flags [P.], seq 7156708:7157148, ack 3745, win 501, length 440
00:12:24.807597 IP ubuntu-s-1vcpu-1gb-intel-tor1-01.ssh > lnsm1-torontoxn-142-116-18-17.internet.virginmobile.ca.61135: Flags [P.], seq 7157148:7157368, ack 3745, win 501, length 220
00:12:24.807633 IP ubuntu-s-1vcpu-1gb-intel-tor1-01.ssh > lnsm1-torontoxn-142-116-18-17.internet.virginmobile.ca.61135: Flags [P.], seq 7157368:7157624, ack 3745, win 501, length 256
00:12:24.807662 IP ubuntu-s-1vcpu-1gb-intel-tor1-01.ssh > lnsm1-torontoxn-142-116-18-17.internet.virginmobile.ca.61135: Flags [P.], seq 7157624:7157844, ack 3745, win 501, length 220
00:12:24.807694 IP ubuntu-s-1vcpu-1gb-intel-tor1-01.ssh > lnsm1-torontoxn-142-116-18-17.internet.virginmobile.ca.61135: Flags [P.], seq 7157844:7158064, ack 3745, win 501, length 220
00:12:24.807731 IP ubuntu-s-1vcpu-1gb-intel-tor1-01.ssh > lnsm1-torontoxn-142-116-18-17.internet.virginmobile.ca.61135: Flags [P.], seq 7158064:7158284, ack 3745, win 501, length 220
00:12:24.807761 IP ubuntu-s-1vcpu-1gb-intel-tor1-01.ssh > lnsm1-torontoxn-142-116-18-17.internet.virginmobile.ca.61135: Flags [P.], seq 7158284:7158504, ack 3745, win 501, length 220
00:12:24.807794 IP ubuntu-s-1vcpu-1gb-intel-tor1-01.ssh > lnsm1-torontoxn-142-116-18-17.internet.virginmobile.ca.61135: Flags [P.], seq 7158504:7158724, ack 3745, win 501, length 220
00:12:24.807829 IP ubuntu-s-1vcpu-1gb-intel-tor1-01.ssh > lnsm1-torontoxn-142-116-18-17.internet.virginmobile.ca.61135: Flags [P.], seq 7158724:7158944, ack 3745, win 501, length 220
00:12:24.807896 IP ubuntu-s-1vcpu-1gb-intel-tor1-01.ssh > lnsm1-torontoxn-142-116-18-17.internet.virginmobile.ca.61135: Flags [P.], seq 7158944:7159164, ack 3745, win 501, length 220
00:12:24.807945 IP ubuntu-s-1vcpu-1gb-intel-tor1-01.ssh > lnsm1-torontoxn-142-116-18-17.internet.virginmobile.ca.61135: Flags [P.], seq 7159164:7159384, ack 3745, win 501, length 220
00:12:24.807990 IP ubuntu-s-1vcpu-1gb-intel-tor1-01.ssh > lnsm1-torontoxn-142-116-18-17.internet.virginmobile.ca.61135: Flags [P.], seq 7159384:7159604, ack 3745, win 501, length 220
00:12:24.808040 IP ubuntu-s-1vcpu-1gb-intel-tor1-01.ssh > lnsm1-torontoxn-142-116-18-17.internet.virginmobile.ca.61135: Flags [P.], seq 7159604:7159824, ack 3745, win 501, length 220
00:12:24.808093 IP ubuntu-s-1vcpu-1gb-intel-tor1-01.ssh > lnsm1-torontoxn-142-116-18-17.internet.virginmobile.ca.61135: Flags [P.], seq 7159824:7160044, ack 3745, win 501, length 220
00:12:24.808110 IP lnsm1-torontoxn-142-116-18-17.internet.virginmobile.ca.61135 > ubuntu-s-1vcpu-1gb-intel-tor1-01.ssh: Flags [.], ack 7059128, win 521, length 0
00:12:24.808110 IP lnsm1-torontoxn-142-116-18-17.internet.virginmobile.ca.61135 > ubuntu-s-1vcpu-1gb-intel-tor1-01.ssh: Flags [.], ack 7059604, win 519, length 0
00:12:24.808110 IP lnsm1-torontoxn-142-116-18-17.internet.virginmobile.ca.61135 > ubuntu-s-1vcpu-1gb-intel-tor1-01.ssh: Flags [.], ack 7061216, win 521, length 0
00:12:24.808175 IP ubuntu-s-1vcpu-1gb-intel-tor1-01.ssh > lnsm1-torontoxn-142-116-18-17.internet.virginmobile.ca.61135: Flags [P.], seq 7160044:7160752, ack 3745, win 501, length 708
00:12:24.808219 IP ubuntu-s-1vcpu-1gb-intel-tor1-01.ssh > lnsm1-torontoxn-142-116-18-17.internet.virginmobile.ca.61135: Flags [P.], seq 7160752:7160972, ack 3745, win 501, length 220
00:12:24.808261 IP ubuntu-s-1vcpu-1gb-intel-tor1-01.ssh > lnsm1-torontoxn-142-116-18-17.internet.virginmobile.ca.61135: Flags [P.], seq 7160972:7161192, ack 3745, win 501, length 220
00:12:24.808304 IP ubuntu-s-1vcpu-1gb-intel-tor1-01.ssh > lnsm1-torontoxn-142-116-18-17.internet.virginmobile.ca.61135: Flags [P.], seq 7161192:7161412, ack 3745, win 501, length 220
00:12:24.808338 IP ubuntu-s-1vcpu-1gb-intel-tor1-01.ssh > lnsm1-torontoxn-142-116-18-17.internet.virginmobile.ca.61135: Flags [P.], seq 7161412:7161668, ack 3745, win 501, length 256
00:12:24.808379 IP ubuntu-s-1vcpu-1gb-intel-tor1-01.ssh > lnsm1-torontoxn-142-116-18-17.internet.virginmobile.ca.61135: Flags [P.], seq 7161668:7161888, ack 3745, win 501, length 220
00:12:24.808423 IP ubuntu-s-1vcpu-1gb-intel-tor1-01.ssh > lnsm1-torontoxn-142-116-18-17.internet.virginmobile.ca.61135: Flags [P.], seq 7161888:7162108, ack 3745, win 501, length 220
00:12:24.808460 IP ubuntu-s-1vcpu-1gb-intel-tor1-01.ssh > lnsm1-torontoxn-142-116-18-17.internet.virginmobile.ca.61135: Flags [P.], seq 7162108:7162364, ack 3745, win 501, length 256
00:12:24.808502 IP ubuntu-s-1vcpu-1gb-intel-tor1-01.ssh > lnsm1-torontoxn-142-116-18-17.internet.virginmobile.ca.61135: Flags [P.], seq 7162364:7162584, ack 3745, win 501, length 220
00:12:24.808545 IP ubuntu-s-1vcpu-1gb-intel-tor1-01.ssh > lnsm1-torontoxn-142-116-18-17.internet.virginmobile.ca.61135: Flags [P.], seq 7162584:7162804, ack 3745, win 501, length 220
00:12:24.808588 IP ubuntu-s-1vcpu-1gb-intel-tor1-01.ssh > lnsm1-torontoxn-142-116-18-17.internet.virginmobile.ca.61135: Flags [P.], seq 7162804:7163024, ack 3745, win 501, length 220
00:12:24.808625 IP ubuntu-s-1vcpu-1gb-intel-tor1-01.ssh > lnsm1-torontoxn-142-116-18-17.internet.virginmobile.ca.61135: Flags [P.], seq 7163024:7163280, ack 3745, win 501, length 256
00:12:24.808667 IP ubuntu-s-1vcpu-1gb-intel-tor1-01.ssh > lnsm1-torontoxn-142-116-18-17.internet.virginmobile.ca.61135: Flags [P.], seq 7163280:7163500, ack 3745, win 501, length 220
00:12:24.808710 IP ubuntu-s-1vcpu-1gb-intel-tor1-01.ssh > lnsm1-torontoxn-142-116-18-17.internet.virginmobile.ca.61135: Flags [P.], seq 7163500:7163720, ack 3745, win 501, length 220
00:12:24.808743 IP ubuntu-s-1vcpu-1gb-intel-tor1-01.ssh > lnsm1-torontoxn-142-116-18-17.internet.virginmobile.ca.61135: Flags [P.], seq 7163720:7163976, ack 3745, win 501, length 256
00:12:24.808785 IP ubuntu-s-1vcpu-1gb-intel-tor1-01.ssh > lnsm1-torontoxn-142-116-18-17.internet.virginmobile.ca.61135: Flags [P.], seq 7163976:7164196, ack 3745, win 501, length 220
00:12:24.808828 IP ubuntu-s-1vcpu-1gb-intel-tor1-01.ssh > lnsm1-torontoxn-142-116-18-17.internet.virginmobile.ca.61135: Flags [P.], seq 7164196:7164416, ack 3745, win 501, length 220
