Capture IP Address Packets

03:26:30.950798 IP 159.203.58.6.22 > 69.157.59.48.65302: Flags [P.], seq 745664:745820, ack 361, win 4063, length 156
03:26:30.950824 IP 159.203.58.6.22 > 69.157.59.48.65302: Flags [P.], seq 745820:745976, ack 361, win 4063, length 156
03:26:30.950849 IP 159.203.58.6.22 > 69.157.59.48.65302: Flags [P.], seq 745976:746132, ack 361, win 4063, length 156
03:26:30.950881 IP 159.203.58.6.22 > 69.157.59.48.65302: Flags [P.], seq 746132:746288, ack 361, win 4063, length 156
03:26:30.950908 IP 159.203.58.6.22 > 69.157.59.48.65302: Flags [P.], seq 746288:746444, ack 361, win 4063, length 156
03:26:30.950932 IP 159.203.58.6.22 > 69.157.59.48.65302: Flags [P.], seq 746444:746600, ack 361, win 4063, length 156
03:26:30.950963 IP 159.203.58.6.22 > 69.157.59.48.65302: Flags [P.], seq 746600:746756, ack 361, win 4063, length 156
03:26:30.950987 IP 159.203.58.6.22 > 69.157.59.48.65302: Flags [P.], seq 746756:746912, ack 361, win 4063, length 156
03:26:31.149220 IP 159.203.58.6.22 > 69.157.59.48.65302: Flags [P.], seq 1197132:1197288, ack 613, win 4063, length 156
03:26:31.149246 IP 159.203.58.6.22 > 69.157.59.48.65302: Flags [P.], seq 1197288:1197444, ack 613, win 4063, length 156
03:26:31.149273 IP 159.203.58.6.22 > 69.157.59.48.65302: Flags [P.], seq 1197444:1197600, ack 613, win 4063, length 156
03:26:31.149298 IP 159.203.58.6.22 > 69.157.59.48.65302: Flags [P.], seq 1197600:1197756, ack 613, win 4063, length 156
03:26:31.149326 IP 159.203.58.6.22 > 69.157.59.48.65302: Flags [P.], seq 1197756:1197912, ack 613, win 4063, length 156
03:26:31.149355 IP 159.203.58.6.22 > 69.157.59.48.65302: Flags [P.], seq 1197912:1198068, ack 613, win 4063, length 156
03:26:31.149383 IP 159.203.58.6.22 > 69.157.59.48.65302: Flags [P.], seq 1198068:1198224, ack 613, win 4063, length 156
03:26:31.149411 IP 159.203.58.6.22 > 69.157.59.48.65302: Flags [P.], seq 1198224:1198380, ack 613, win 4063, length 156
03:26:31.149438 IP 159.203.58.6.22 > 69.157.59.48.65302: Flags [P.], seq 1198380:1198536, ack 613, win 4063, length 156
03:26:31.149465 IP 159.203.58.6.22 > 69.157.59.48.65302: Flags [P.], seq 1198536:1198692, ack 613, win 4063, length 156
03:26:31.149491 IP 159.203.58.6.22 > 69.157.59.48.65302: Flags [P.], seq 1198692:1198848, ack 613, win 4063, length 156
03:26:31.149523 IP 159.203.58.6.22 > 69.157.59.48.65302: Flags [P.], seq 1198848:1199004, ack 613, win 4063, length 156
03:26:31.149550 IP 159.203.58.6.22 > 69.157.59.48.65302: Flags [P.], seq 1199004:1199160, ack 613, win 4063, length 156
03:26:31.149575 IP 159.203.58.6.22 > 69.157.59.48.65302: Flags [P.], seq 1199160:1199316, ack 613, win 4063, length 156
03:26:31.149603 IP 159.203.58.6.22 > 69.157.59.48.65302: Flags [P.], seq 1199316:1199472, ack 613, win 4063, length 156
03:26:31.149630 IP 159.203.58.6.22 > 69.157.59.48.65302: Flags [P.], seq 1199472:1199628, ack 613, win 4063, length 156
03:26:31.149658 IP 159.203.58.6.22 > 69.157.59.48.65302: Flags [P.], seq 1199628:1199784, ack 613, win 4063, length 156
03:26:31.149685 IP 159.203.58.6.22 > 69.157.59.48.65302: Flags [P.], seq 1199784:1199940, ack 613, win 4063, length 156
03:26:31.149715 IP 159.203.58.6.22 > 69.157.59.48.65302: Flags [P.], seq 1199940:1200096, ack 613, win 4063, length 156
03:26:31.149742 IP 159.203.58.6.22 > 69.157.59.48.65302: Flags [P.], seq 1200096:1200252, ack 613, win 4063, length 156
03:26:31.149767 IP 159.203.58.6.22 > 69.157.59.48.65302: Flags [P.], seq 1200252:1200408, ack 613, win 4063, length 156
03:26:31.149793 IP 159.203.58.6.22 > 69.157.59.48.65302: Flags [P.], seq 1200408:1200564, ack 613, win 4063, length 156
03:26:31.149821 IP 159.203.58.6.22 > 69.157.59.48.65302: Flags [P.], seq 1200564:1200720, ack 613, win 4063, length 156
03:26:31.149845 IP 159.203.58.6.22 > 69.157.59.48.65302: Flags [P.], seq 1200720:1200876, ack 613, win 4063, length 156
03:26:31.149873 IP 159.203.58.6.22 > 69.157.59.48.65302: Flags [P.], seq 1200876:1201032, ack 613, win 4063, length 156
03:26:31.149902 IP 159.203.58.6.22 > 69.157.59.48.65302: Flags [P.], seq 1201032:1201188, ack 613, win 4063, length 156
03:26:31.149930 IP 159.203.58.6.22 > 69.157.59.48.65302: Flags [P.], seq 1201188:1201344, ack 613, win 4063, length 156
03:26:31.149958 IP 159.203.58.6.22 > 69.157.59.48.65302: Flags [P.], seq 1201344:1201500, ack 613, win 4063, length 156
03:26:31.149983 IP 159.203.58.6.22 > 69.157.59.48.65302: Flags [P.], seq 1201500:1201656, ack 613, win 4063, length 156
03:26:31.150010 IP 159.203.58.6.22 > 69.157.59.48.65302: Flags [P.], seq 1201656:1201812, ack 613, win 4063, length 156
03:26:31.150046 IP 159.203.58.6.22 > 69.157.59.48.65302: Flags [P.], seq 1201812:1201968, ack 613, win 4063, length 156
03:26:31.150069 IP 159.203.58.6.22 > 69.157.59.48.65302: Flags [P.], seq 1201968:1202124, ack 613, win 4063, length 156
03:26:31.150094 IP 159.203.58.6.22 > 69.157.59.48.65302: Flags [P.], seq 1202124:1202280, ack 613, win 4063, length 156
03:26:31.150140 IP 159.203.58.6.22 > 69.157.59.48.65302: Flags [P.], seq 1202280:1202436, ack 613, win 4063, length 156
03:26:31.150167 IP 159.203.58.6.22 > 69.157.59.48.65302: Flags [P.], seq 1202436:1202592, ack 613, win 4063, length 156
03:26:31.150210 IP 159.203.58.6.22 > 69.157.59.48.65302: Flags [P.], seq 1202592:1202748, ack 613, win 4063, length 156
03:26:31.150247 IP 159.203.58.6.22 > 69.157.59.48.65302: Flags [P.], seq 1202748:1202904, ack 613, win 4063, length 156
03:26:31.150277 IP 159.203.58.6.22 > 69.157.59.48.65302: Flags [P.], seq 1202904:1203060, ack 613, win 4063, length 156
03:26:31.150302 IP 159.203.58.6.22 > 69.157.59.48.65302: Flags [P.], seq 1203060:1203216, ack 613, win 4063, length 156
03:26:31.150327 IP 159.203.58.6.22 > 69.157.59.48.65302: Flags [P.], seq 1203216:1203372, ack 613, win 4063, length 156
03:26:31.150358 IP 159.203.58.6.22 > 69.157.59.48.65302: Flags [P.], seq 1203372:1203528, ack 613, win 4063, length 156
03:26:31.150383 IP 159.203.58.6.22 > 69.157.59.48.65302: Flags [P.], seq 1203528:1203684, ack 613, win 4063, length 156
03:26:31.150407 IP 159.203.58.6.22 > 69.157.59.48.65302: Flags [P.], seq 1203684:1203840, ack 613, win 4063, length 156
03:26:31.150451 IP 159.203.58.6.22 > 69.157.59.48.65302: Flags [P.], seq 1203840:1203996, ack 613, win 4063, length 156
03:26:31.150473 IP 69.157.59.48.65302 > 159.203.58.6.22: Flags [.], ack 1190060, win 2064, length 0
03:26:31.150473 IP 69.157.59.48.65302 > 159.203.58.6.22: Flags [.], ack 1194584, win 2064, length 0
03:26:31.150566 IP 159.203.58.6.22 > 69.157.59.48.65302: Flags [P.], seq 1203996:1204360, ack 613, win 4063, length 364
03:26:31.150594 IP 159.203.58.6.22 > 69.157.59.48.65302: Flags [P.], seq 1204360:1204516, ack 613, win 4063, length 156
03:26:31.150627 IP 159.203.58.6.22 > 69.157.59.48.65302: Flags [P.], seq 1204516:1204672, ack 613, win 4063, length 156
03:26:31.150655 IP 159.203.58.6.22 > 69.157.59.48.65302: Flags [P.], seq 1204672:1204828, ack 613, win 4063, length 156
03:26:31.150681 IP 159.203.58.6.22 > 69.157.59.48.65302: Flags [P.], seq 1204828:1204984, ack 613, win 4063, length 156
03:26:31.150708 IP 159.203.58.6.22 > 69.157.59.48.65302: Flags [P.], seq 1204984:1205140, ack 613, win 4063, length 156
03:26:31.150734 IP 159.203.58.6.22 > 69.157.59.48.65302: Flags [P.], seq 1205140:1205296, ack 613, win 4063, length 156
03:26:31.150761 IP 159.203.58.6.22 > 69.157.59.48.65302: Flags [P.], seq 1205296:1205452, ack 613, win 4063, length 156
03:26:31.150787 IP 159.203.58.6.22 > 69.157.59.48.65302: Flags [P.], seq 1205452:1205608, ack 613, win 4063, length 156
03:26:31.150818 IP 159.203.58.6.22 > 69.157.59.48.65302: Flags [P.], seq 1205608:1205764, ack 613, win 4063, length 156
03:26:31.150846 IP 159.203.58.6.22 > 69.157.59.48.65302: Flags [P.], seq 1205764:1205920, ack 613, win 4063, length 156
03:26:31.150873 IP 159.203.58.6.22 > 69.157.59.48.65302: Flags [P.], seq 1205920:1206076, ack 613, win 4063, length 156
03:26:31.150900 IP 159.203.58.6.22 > 69.157.59.48.65302: Flags [P.], seq 1206076:1206232, ack 613, win 4063, length 156
03:26:31.150927 IP 159.203.58.6.22 > 69.157.59.48.65302: Flags [P.], seq 1206232:1206388, ack 613, win 4063, length 156
03:26:31.150953 IP 159.203.58.6.22 > 69.157.59.48.65302: Flags [P.], seq 1206388:1206544, ack 613, win 4063, length 156
03:26:31.150980 IP 159.203.58.6.22 > 69.157.59.48.65302: Flags [P.], seq 1206544:1206700, ack 613, win 4063, length 156
03:26:31.151012 IP 159.203.58.6.22 > 69.157.59.48.65302: Flags [P.], seq 1206700:1206856, ack 613, win 4063, length 156
03:26:31.151048 IP 159.203.58.6.22 > 69.157.59.48.65302: Flags [P.], seq 1206856:1207012, ack 613, win 4063, length 156
03:26:31.151074 IP 159.203.58.6.22 > 69.157.59.48.65302: Flags [P.], seq 1207012:1207168, ack 613, win 4063, length 156
03:26:31.151099 IP 159.203.58.6.22 > 69.157.59.48.65302: Flags [P.], seq 1207168:1207324, ack 613, win 4063, length 156
03:26:31.151124 IP 159.203.58.6.22 > 69.157.59.48.65302: Flags [P.], seq 1207324:1207480, ack 613, win 4063, length 156
03:26:31.151148 IP 159.203.58.6.22 > 69.157.59.48.65302: Flags [P.], seq 1207480:1207636, ack 613, win 4063, length 156
03:26:31.151172 IP 159.203.58.6.22 > 69.157.59.48.65302: Flags [P.], seq 1207636:1207792, ack 613, win 4063, length 156
03:26:31.151218 IP 159.203.58.6.22 > 69.157.59.48.65302: Flags [P.], seq 1207792:1207948, ack 613, win 4063, length 156
03:26:31.151244 IP 159.203.58.6.22 > 69.157.59.48.65302: Flags [P.], seq 1207948:1208104, ack 613, win 4063, length 156
03:26:31.151269 IP 159.203.58.6.22 > 69.157.59.48.65302: Flags [P.], seq 1208104:1208260, ack 613, win 4063, length 156
03:26:31.151294 IP 159.203.58.6.22 > 69.157.59.48.65302: Flags [P.], seq 1208260:1208416, ack 613, win 4063, length 156
03:26:31.151320 IP 159.203.58.6.22 > 69.157.59.48.65302: Flags [P.], seq 1208416:1208572, ack 613, win 4063, length 156
03:26:31.151347 IP 159.203.58.6.22 > 69.157.59.48.65302: Flags [P.], seq 1208572:1208728, ack 613, win 4063, length 156
03:26:31.151373 IP 159.203.58.6.22 > 69.157.59.48.65302: Flags [P.], seq 1208728:1208884, ack 613, win 4063, length 156
03:26:31.151405 IP 159.203.58.6.22 > 69.157.59.48.65302: Flags [P.], seq 1208884:1209040, ack 613, win 4063, length 156
03:26:31.151431 IP 159.203.58.6.22 > 69.157.59.48.65302: Flags [P.], seq 1209040:1209196, ack 613, win 4063, length 156
03:26:31.151459 IP 159.203.58.6.22 > 69.157.59.48.65302: Flags [P.], seq 1209196:1209352, ack 613, win 4063, length 156
03:26:31.151485 IP 159.203.58.6.22 > 69.157.59.48.65302: Flags [P.], seq 1209352:1209508, ack 613, win 4063, length 156
03:26:31.151511 IP 159.203.58.6.22 > 69.157.59.48.65302: Flags [P.], seq 1209508:1209664, ack 613, win 4063, length 156
03:26:31.151539 IP 159.203.58.6.22 > 69.157.59.48.65302: Flags [P.], seq 1209664:1209820, ack 613, win 4063, length 156
03:26:31.151568 IP 159.203.58.6.22 > 69.157.59.48.65302: Flags [P.], seq 1209820:1209976, ack 613, win 4063, length 156
03:26:31.151600 IP 159.203.58.6.22 > 69.157.59.48.65302: Flags [P.], seq 1209976:1210132, ack 613, win 4063, length 156
03:26:31.151628 IP 159.203.58.6.22 > 69.157.59.48.65302: Flags [P.], seq 1210132:1210288, ack 613, win 4063, length 156
03:26:31.151653 IP 159.203.58.6.22 > 69.157.59.48.65302: Flags [P.], seq 1210288:1210444, ack 613, win 4063, length 156
03:26:31.151680 IP 159.203.58.6.22 > 69.157.59.48.65302: Flags [P.], seq 1210444:1210600, ack 613, win 4063, length 156
03:26:31.151707 IP 159.203.58.6.22 > 69.157.59.48.65302: Flags [P.], seq 1210600:1210756, ack 613, win 4063, length 156
03:26:31.151732 IP 159.203.58.6.22 > 69.157.59.48.65302: Flags [P.], seq 1210756:1210912, ack 613, win 4063, length 156
03:26:31.151758 IP 159.203.58.6.22 > 69.157.59.48.65302: Flags [P.], seq 1210912:1211068, ack 613, win 4063, length 156
03:26:31.151782 IP 159.203.58.6.22 > 69.157.59.48.65302: Flags [P.], seq 1211068:1211224, ack 613, win 4063, length 156
03:26:31.151814 IP 159.203.58.6.22 > 69.157.59.48.65302: Flags [P.], seq 1211224:1211380, ack 613, win 4063, length 156
03:26:31.151840 IP 159.203.58.6.22 > 69.157.59.48.65302: Flags [P.], seq 1211380:1211536, ack 613, win 4063, length 156
03:26:31.151867 IP 159.203.58.6.22 > 69.157.59.48.65302: Flags [P.], seq 1211536:1211692, ack 613, win 4063, length 156
03:26:31.151893 IP 159.203.58.6.22 > 69.157.59.48.65302: Flags [P.], seq 1211692:1211848, ack 613, win 4063, length 156
03:26:31.151917 IP 159.203.58.6.22 > 69.157.59.48.65302: Flags [P.], seq 1211848:1212004, ack 613, win 4063, length 156
03:26:31.151943 IP 159.203.58.6.22 > 69.157.59.48.65302: Flags [P.], seq 1212004:1212160, ack 613, win 4063, length 156
03:26:31.151977 IP 159.203.58.6.22 > 69.157.59.48.65302: Flags [P.], seq 1212160:1212316, ack 613, win 4063, length 156
03:26:31.152012 IP 159.203.58.6.22 > 69.157.59.48.65302: Flags [P.], seq 1212316:1212472, ack 613, win 4063, length 156
03:26:31.152041 IP 159.203.58.6.22 > 69.157.59.48.65302: Flags [P.], seq 1212472:1212628, ack 613, win 4063, length 156
03:26:31.152068 IP 159.203.58.6.22 > 69.157.59.48.65302: Flags [P.], seq 1212628:1212784, ack 613, win 4063, length 156
03:26:31.152094 IP 159.203.58.6.22 > 69.157.59.48.65302: Flags [P.], seq 1212784:1212940, ack 613, win 4063, length 156
03:26:31.152121 IP 159.203.58.6.22 > 69.157.59.48.65302: Flags [P.], seq 1212940:1213096, ack 613, win 4063, length 156
03:26:31.152145 IP 159.203.58.6.22 > 69.157.59.48.65302: Flags [P.], seq 1213096:1213252, ack 613, win 4063, length 156
03:26:31.152172 IP 159.203.58.6.22 > 69.157.59.48.65302: Flags [P.], seq 1213252:1213408, ack 613, win 4063, length 156
03:26:31.152201 IP 159.203.58.6.22 > 69.157.59.48.65302: Flags [P.], seq 1213408:1213564, ack 613, win 4063, length 156
03:26:31.152229 IP 159.203.58.6.22 > 69.157.59.48.65302: Flags [P.], seq 1213564:1213720, ack 613, win 4063, length 156
03:26:31.152253 IP 159.203.58.6.22 > 69.157.59.48.65302: Flags [P.], seq 1213720:1213876, ack 613, win 4063, length 156
03:26:31.152279 IP 159.203.58.6.22 > 69.157.59.48.65302: Flags [P.], seq 1213876:1214032, ack 613, win 4063, length 156
03:26:31.152306 IP 159.203.58.6.22 > 69.157.59.48.65302: Flags [P.], seq 1214032:1214188, ack 613, win 4063, length 156
03:26:31.152345 IP 159.203.58.6.22 > 69.157.59.48.65302: Flags [P.], seq 1214188:1214344, ack 613, win 4063, length 156
03:26:31.152373 IP 159.203.58.6.22 > 69.157.59.48.65302: Flags [P.], seq 1214344:1214500, ack 613, win 4063, length 156
03:26:31.152398 IP 159.203.58.6.22 > 69.157.59.48.65302: Flags [P.], seq 1214500:1214656, ack 613, win 4063, length 156
03:26:31.152431 IP 159.203.58.6.22 > 69.157.59.48.65302: Flags [P.], seq 1214656:1214812, ack 613, win 4063, length 156
03:26:31.152458 IP 159.203.58.6.22 > 69.157.59.48.65302: Flags [P.], seq 1214812:1214968, ack 613, win 4063, length 156
03:26:31.152483 IP 159.203.58.6.22 > 69.157.59.48.65302: Flags [P.], seq 1214968:1215124, ack 613, win 4063, length 156
03:26:31.152509 IP 159.203.58.6.22 > 69.157.59.48.65302: Flags [P.], seq 1215124:1215280, ack 613, win 4063, length 156
03:26:31.152534 IP 159.203.58.6.22 > 69.157.59.48.65302: Flags [P.], seq 1215280:1215436, ack 613, win 4063, length 156
03:26:31.152560 IP 159.203.58.6.22 > 69.157.59.48.65302: Flags [P.], seq 1215436:1215592, ack 613, win 4063, length 156
03:26:31.152585 IP 159.203.58.6.22 > 69.157.59.48.65302: Flags [P.], seq 1215592:1215748, ack 613, win 4063, length 156
03:26:31.152615 IP 159.203.58.6.22 > 69.157.59.48.65302: Flags [P.], seq 1215748:1215904, ack 613, win 4063, length 156
03:26:31.152643 IP 159.203.58.6.22 > 69.157.59.48.65302: Flags [P.], seq 1215904:1216060, ack 613, win 4063, length 156
03:26:31.152668 IP 159.203.58.6.22 > 69.157.59.48.65302: Flags [P.], seq 1216060:1216216, ack 613, win 4063, length 156
03:26:31.152694 IP 159.203.58.6.22 > 69.157.59.48.65302: Flags [P.], seq 1216216:1216372, ack 613, win 4063, length 156
03:26:31.152719 IP 159.203.58.6.22 > 69.157.59.48.65302: Flags [P.], seq 1216372:1216528, ack 613, win 4063, length 156
03:26:31.152745 IP 159.203.58.6.22 > 69.157.59.48.65302: Flags [P.], seq 1216528:1216684, ack 613, win 4063, length 156
03:26:31.152770 IP 159.203.58.6.22 > 69.157.59.48.65302: Flags [P.], seq 1216684:1216840, ack 613, win 4063, length 156
03:26:31.152796 IP 159.203.58.6.22 > 69.157.59.48.65302: Flags [P.], seq 1216840:1216996, ack 613, win 4063, length 156
03:26:31.152827 IP 159.203.58.6.22 > 69.157.59.48.65302: Flags [P.], seq 1216996:1217152, ack 613, win 4063, length 156
03:26:31.152853 IP 159.203.58.6.22 > 69.157.59.48.65302: Flags [P.], seq 1217152:1217308, ack 613, win 4063, length 156
03:26:31.152880 IP 159.203.58.6.22 > 69.157.59.48.65302: Flags [P.], seq 1217308:1217464, ack 613, win 4063, length 156
03:26:31.152920 IP 159.203.58.6.22 > 69.157.59.48.65302: Flags [P.], seq 1217464:1217620, ack 613, win 4063, length 156
03:26:31.152945 IP 159.203.58.6.22 > 69.157.59.48.65302: Flags [P.], seq 1217620:1217776, ack 613, win 4063, length 156
03:26:31.152974 IP 159.203.58.6.22 > 69.157.59.48.65302: Flags [P.], seq 1217776:1217932, ack 613, win 4063, length 156
03:26:31.153001 IP 159.203.58.6.22 > 69.157.59.48.65302: Flags [P.], seq 1217932:1218088, ack 613, win 4063, length 156
03:26:31.153027 IP 159.203.58.6.22 > 69.157.59.48.65302: Flags [P.], seq 1218088:1218244, ack 613, win 4063, length 156
03:26:31.153052 IP 159.203.58.6.22 > 69.157.59.48.65302: Flags [P.], seq 1218244:1218400, ack 613, win 4063, length 156
03:26:31.153080 IP 159.203.58.6.22 > 69.157.59.48.65302: Flags [P.], seq 1218400:1218556, ack 613, win 4063, length 156
03:26:31.153107 IP 159.203.58.6.22 > 69.157.59.48.65302: Flags [P.], seq 1218556:1218712, ack 613, win 4063, length 156
03:26:31.153132 IP 159.203.58.6.22 > 69.157.59.48.65302: Flags [P.], seq 1218712:1218868, ack 613, win 4063, length 156
03:26:31.153165 IP 159.203.58.6.22 > 69.157.59.48.65302: Flags [P.], seq 1218868:1219024, ack 613, win 4063, length 156
03:26:31.153192 IP 159.203.58.6.22 > 69.157.59.48.65302: Flags [P.], seq 1219024:1219180, ack 613, win 4063, length 156
03:26:31.153217 IP 159.203.58.6.22 > 69.157.59.48.65302: Flags [P.], seq 1219180:1219336, ack 613, win 4063, length 156
03:26:31.153243 IP 159.203.58.6.22 > 69.157.59.48.65302: Flags [P.], seq 1219336:1219492, ack 613, win 4063, length 156
03:26:31.153269 IP 159.203.58.6.22 > 69.157.59.48.65302: Flags [P.], seq 1219492:1219648, ack 613, win 4063, length 156
03:26:31.153294 IP 159.203.58.6.22 > 69.157.59.48.65302: Flags [P.], seq 1219648:1219804, ack 613, win 4063, length 156
03:26:31.153326 IP 159.203.58.6.22 > 69.157.59.48.65302: Flags [P.], seq 1219804:1219960, ack 613, win 4063, length 156
03:26:31.153352 IP 159.203.58.6.22 > 69.157.59.48.65302: Flags [P.], seq 1219960:1220116, ack 613, win 4063, length 156
03:26:31.153378 IP 159.203.58.6.22 > 69.157.59.48.65302: Flags [P.], seq 1220116:1220272, ack 613, win 4063, length 156
03:26:31.153403 IP 159.203.58.6.22 > 69.157.59.48.65302: Flags [P.], seq 1220272:1220428, ack 613, win 4063, length 156
03:26:31.153430 IP 159.203.58.6.22 > 69.157.59.48.65302: Flags [P.], seq 1220428:1220584, ack 613, win 4063, length 156
03:26:31.153457 IP 159.203.58.6.22 > 69.157.59.48.65302: Flags [P.], seq 1220584:1220740, ack 613, win 4063, length 156
03:26:31.153484 IP 159.203.58.6.22 > 69.157.59.48.65302: Flags [P.], seq 1220740:1220896, ack 613, win 4063, length 156
03:26:31.153509 IP 159.203.58.6.22 > 69.157.59.48.65302: Flags [P.], seq 1220896:1221052, ack 613, win 4063, length 156
03:26:31.153541 IP 159.203.58.6.22 > 69.157.59.48.65302: Flags [P.], seq 1221052:1221208, ack 613, win 4063, length 156
03:26:31.153568 IP 159.203.58.6.22 > 69.157.59.48.65302: Flags [P.], seq 1221208:1221364, ack 613, win 4063, length 156
03:26:31.153593 IP 159.203.58.6.22 > 69.157.59.48.65302: Flags [P.], seq 1221364:1221520, ack 613, win 4063, length 156
03:26:31.153621 IP 159.203.58.6.22 > 69.157.59.48.65302: Flags [P.], seq 1221520:1221676, ack 613, win 4063, length 156
03:26:31.153646 IP 159.203.58.6.22 > 69.157.59.48.65302: Flags [P.], seq 1221676:1221832, ack 613, win 4063, length 156
03:26:31.153672 IP 159.203.58.6.22 > 69.157.59.48.65302: Flags [P.], seq 1221832:1221988, ack 613, win 4063, length 156
03:26:31.153704 IP 159.203.58.6.22 > 69.157.59.48.65302: Flags [P.], seq 1221988:1222144, ack 613, win 4063, length 156
03:26:31.153730 IP 159.203.58.6.22 > 69.157.59.48.65302: Flags [P.], seq 1222144:1222300, ack 613, win 4063, length 156
03:26:31.153756 IP 159.203.58.6.22 > 69.157.59.48.65302: Flags [P.], seq 1222300:1222456, ack 613, win 4063, length 156
03:26:31.153781 IP 159.203.58.6.22 > 69.157.59.48.65302: Flags [P.], seq 1222456:1222612, ack 613, win 4063, length 156
03:26:31.153807 IP 159.203.58.6.22 > 69.157.59.48.65302: Flags [P.], seq 1222612:1222768, ack 613, win 4063, length 156
03:26:31.153833 IP 159.203.58.6.22 > 69.157.59.48.65302: Flags [P.], seq 1222768:1222924, ack 613, win 4063, length 156
03:26:31.153858 IP 159.203.58.6.22 > 69.157.59.48.65302: Flags [P.], seq 1222924:1223080, ack 613, win 4063, length 156
03:26:31.153884 IP 159.203.58.6.22 > 69.157.59.48.65302: Flags [P.], seq 1223080:1223236, ack 613, win 4063, length 156
03:26:31.153915 IP 159.203.58.6.22 > 69.157.59.48.65302: Flags [P.], seq 1223236:1223392, ack 613, win 4063, length 156
03:26:31.153944 IP 159.203.58.6.22 > 69.157.59.48.65302: Flags [P.], seq 1223392:1223548, ack 613, win 4063, length 156
03:26:31.153969 IP 159.203.58.6.22 > 69.157.59.48.65302: Flags [P.], seq 1223548:1223704, ack 613, win 4063, length 156
03:26:31.153995 IP 159.203.58.6.22 > 69.157.59.48.65302: Flags [P.], seq 1223704:1223860, ack 613, win 4063, length 156
03:26:31.154021 IP 159.203.58.6.22 > 69.157.59.48.65302: Flags [P.], seq 1223860:1224016, ack 613, win 4063, length 156
03:26:31.154046 IP 159.203.58.6.22 > 69.157.59.48.65302: Flags [P.], seq 1224016:1224172, ack 613, win 4063, length 156
03:26:31.154072 IP 159.203.58.6.22 > 69.157.59.48.65302: Flags [P.], seq 1224172:1224328, ack 613, win 4063, length 156
03:26:31.154101 IP 159.203.58.6.22 > 69.157.59.48.65302: Flags [P.], seq 1224328:1224484, ack 613, win 4063, length 156
03:26:31.154130 IP 159.203.58.6.22 > 69.157.59.48.65302: Flags [P.], seq 1224484:1224640, ack 613, win 4063, length 156
03:26:31.154156 IP 159.203.58.6.22 > 69.157.59.48.65302: Flags [P.], seq 1224640:1224796, ack 613, win 4063, length 156
03:26:31.154220 IP 159.203.58.6.22 > 69.157.59.48.65302: Flags [P.], seq 1224796:1224952, ack 613, win 4063, length 156
03:26:31.154254 IP 159.203.58.6.22 > 69.157.59.48.65302: Flags [P.], seq 1224952:1225108, ack 613, win 4063, length 156
03:26:31.154281 IP 159.203.58.6.22 > 69.157.59.48.65302: Flags [P.], seq 1225108:1225264, ack 613, win 4063, length 156
03:26:31.154313 IP 159.203.58.6.22 > 69.157.59.48.65302: Flags [P.], seq 1225264:1225420, ack 613, win 4063, length 156
03:26:31.154338 IP 159.203.58.6.22 > 69.157.59.48.65302: Flags [P.], seq 1225420:1225576, ack 613, win 4063, length 156
03:26:31.154364 IP 159.203.58.6.22 > 69.157.59.48.65302: Flags [P.], seq 1225576:1225732, ack 613, win 4063, length 156
03:26:31.154391 IP 159.203.58.6.22 > 69.157.59.48.65302: Flags [P.], seq 1225732:1225888, ack 613, win 4063, length 156
03:26:31.154417 IP 159.203.58.6.22 > 69.157.59.48.65302: Flags [P.], seq 1225888:1226044, ack 613, win 4063, length 156
03:26:31.154442 IP 159.203.58.6.22 > 69.157.59.48.65302: Flags [P.], seq 1226044:1226200, ack 613, win 4063, length 156
03:26:31.154454 IP 69.157.59.48.65302 > 159.203.58.6.22: Flags [.], ack 1199940, win 2064, length 0
03:26:31.154454 IP 69.157.59.48.65302 > 159.203.58.6.22: Flags [.], ack 1203060, win 2064, length 0
03:26:31.154506 IP 159.203.58.6.22 > 69.157.59.48.65302: Flags [P.], seq 1226200:1226564, ack 613, win 4063, length 364
03:26:31.154536 IP 159.203.58.6.22 > 69.157.59.48.65302: Flags [P.], seq 1226564:1226720, ack 613, win 4063, length 156
03:26:31.154562 IP 159.203.58.6.22 > 69.157.59.48.65302: Flags [P.], seq 1226720:1226876, ack 613, win 4063, length 156
03:26:31.154587 IP 159.203.58.6.22 > 69.157.59.48.65302: Flags [P.], seq 1226876:1227032, ack 613, win 4063, length 156
03:26:31.154611 IP 159.203.58.6.22 > 69.157.59.48.65302: Flags [P.], seq 1227032:1227188, ack 613, win 4063, length 156
03:26:31.154638 IP 159.203.58.6.22 > 69.157.59.48.65302: Flags [P.], seq 1227188:1227344, ack 613, win 4063, length 156
03:26:31.154662 IP 159.203.58.6.22 > 69.157.59.48.65302: Flags [P.], seq 1227344:1227500, ack 613, win 4063, length 156
03:26:31.154689 IP 159.203.58.6.22 > 69.157.59.48.65302: Flags [P.], seq 1227500:1227656, ack 613, win 4063, length 156
03:26:31.154715 IP 159.203.58.6.22 > 69.157.59.48.65302: Flags [P.], seq 1227656:1227812, ack 613, win 4063, length 156
03:26:31.154744 IP 159.203.58.6.22 > 69.157.59.48.65302: Flags [P.], seq 1227812:1227968, ack 613, win 4063, length 156
03:26:31.154771 IP 159.203.58.6.22 > 69.157.59.48.65302: Flags [P.], seq 1227968:1228124, ack 613, win 4063, length 156
03:26:31.154796 IP 159.203.58.6.22 > 69.157.59.48.65302: Flags [P.], seq 1228124:1228280, ack 613, win 4063, length 156
03:26:31.154822 IP 159.203.58.6.22 > 69.157.59.48.65302: Flags [P.], seq 1228280:1228436, ack 613, win 4063, length 156
03:26:31.154849 IP 159.203.58.6.22 > 69.157.59.48.65302: Flags [P.], seq 1228436:1228592, ack 613, win 4063, length 156
03:26:31.154874 IP 159.203.58.6.22 > 69.157.59.48.65302: Flags [P.], seq 1228592:1228748, ack 613, win 4063, length 156
03:26:31.154900 IP 159.203.58.6.22 > 69.157.59.48.65302: Flags [P.], seq 1228748:1228904, ack 613, win 4063, length 156
03:26:31.154929 IP 159.203.58.6.22 > 69.157.59.48.65302: Flags [P.], seq 1228904:1229060, ack 613, win 4063, length 156
03:26:31.155044 IP 159.203.58.6.22 > 69.157.59.48.65302: Flags [P.], seq 1229060:1229216, ack 613, win 4063, length 156
03:26:31.155078 IP 159.203.58.6.22 > 69.157.59.48.65302: Flags [P.], seq 1229216:1229372, ack 613, win 4063, length 156
03:26:31.155106 IP 159.203.58.6.22 > 69.157.59.48.65302: Flags [P.], seq 1229372:1229528, ack 613, win 4063, length 156
03:26:31.155132 IP 159.203.58.6.22 > 69.157.59.48.65302: Flags [P.], seq 1229528:1229684, ack 613, win 4063, length 156
03:26:31.155158 IP 159.203.58.6.22 > 69.157.59.48.65302: Flags [P.], seq 1229684:1229840, ack 613, win 4063, length 156
03:26:31.155183 IP 159.203.58.6.22 > 69.157.59.48.65302: Flags [P.], seq 1229840:1229996, ack 613, win 4063, length 156
03:26:31.155215 IP 159.203.58.6.22 > 69.157.59.48.65302: Flags [P.], seq 1229996:1230152, ack 613, win 4063, length 156
03:26:31.155241 IP 159.203.58.6.22 > 69.157.59.48.65302: Flags [P.], seq 1230152:1230308, ack 613, win 4063, length 156
03:26:31.155269 IP 159.203.58.6.22 > 69.157.59.48.65302: Flags [P.], seq 1230308:1230464, ack 613, win 4063, length 156
03:26:31.155294 IP 159.203.58.6.22 > 69.157.59.48.65302: Flags [P.], seq 1230464:1230620, ack 613, win 4063, length 156
03:26:31.155320 IP 159.203.58.6.22 > 69.157.59.48.65302: Flags [P.], seq 1230620:1230776, ack 613, win 4063, length 156
03:26:31.155346 IP 159.203.58.6.22 > 69.157.59.48.65302: Flags [P.], seq 1230776:1230932, ack 613, win 4063, length 156
03:26:31.155371 IP 159.203.58.6.22 > 69.157.59.48.65302: Flags [P.], seq 1230932:1231088, ack 613, win 4063, length 156
03:26:31.155403 IP 159.203.58.6.22 > 69.157.59.48.65302: Flags [P.], seq 1231088:1231244, ack 613, win 4063, length 156
03:26:31.155431 IP 159.203.58.6.22 > 69.157.59.48.65302: Flags [P.], seq 1231244:1231400, ack 613, win 4063, length 156
03:26:31.155456 IP 159.203.58.6.22 > 69.157.59.48.65302: Flags [P.], seq 1231400:1231556, ack 613, win 4063, length 156
03:26:31.155496 IP 159.203.58.6.22 > 69.157.59.48.65302: Flags [P.], seq 1231556:1231712, ack 613, win 4063, length 156
03:26:31.155520 IP 159.203.58.6.22 > 69.157.59.48.65302: Flags [P.], seq 1231712:1231868, ack 613, win 4063, length 156
03:26:31.155545 IP 159.203.58.6.22 > 69.157.59.48.65302: Flags [P.], seq 1231868:1232024, ack 613, win 4063, length 156
03:26:31.155570 IP 159.203.58.6.22 > 69.157.59.48.65302: Flags [P.], seq 1232024:1232180, ack 613, win 4063, length 156
03:26:31.155600 IP 159.203.58.6.22 > 69.157.59.48.65302: Flags [P.], seq 1232180:1232336, ack 613, win 4063, length 156
03:26:31.155626 IP 159.203.58.6.22 > 69.157.59.48.65302: Flags [P.], seq 1232336:1232492, ack 613, win 4063, length 156
03:26:31.155664 IP 159.203.58.6.22 > 69.157.59.48.65302: Flags [P.], seq 1232492:1232648, ack 613, win 4063, length 156
03:26:31.155690 IP 159.203.58.6.22 > 69.157.59.48.65302: Flags [P.], seq 1232648:1232804, ack 613, win 4063, length 156
03:26:31.155714 IP 159.203.58.6.22 > 69.157.59.48.65302: Flags [P.], seq 1232804:1232960, ack 613, win 4063, length 156
03:26:31.155739 IP 159.203.58.6.22 > 69.157.59.48.65302: Flags [P.], seq 1232960:1233116, ack 613, win 4063, length 156
03:26:31.155771 IP 159.203.58.6.22 > 69.157.59.48.65302: Flags [P.], seq 1233116:1233272, ack 613, win 4063, length 156
03:26:31.155807 IP 159.203.58.6.22 > 69.157.59.48.65302: Flags [P.], seq 1233272:1233428, ack 613, win 4063, length 156
03:26:31.155844 IP 159.203.58.6.22 > 69.157.59.48.65302: Flags [P.], seq 1233428:1233584, ack 613, win 4063, length 156
03:26:31.155878 IP 159.203.58.6.22 > 69.157.59.48.65302: Flags [P.], seq 1233584:1233740, ack 613, win 4063, length 156
03:26:31.155917 IP 159.203.58.6.22 > 69.157.59.48.65302: Flags [P.], seq 1233740:1233896, ack 613, win 4063, length 156
03:26:31.155947 IP 159.203.58.6.22 > 69.157.59.48.65302: Flags [P.], seq 1233896:1234052, ack 613, win 4063, length 156
03:26:31.155971 IP 159.203.58.6.22 > 69.157.59.48.65302: Flags [P.], seq 1234052:1234208, ack 613, win 4063, length 156
03:26:31.155997 IP 159.203.58.6.22 > 69.157.59.48.65302: Flags [P.], seq 1234208:1234364, ack 613, win 4063, length 156
03:26:31.156021 IP 159.203.58.6.22 > 69.157.59.48.65302: Flags [P.], seq 1234364:1234520, ack 613, win 4063, length 156
03:26:31.156051 IP 159.203.58.6.22 > 69.157.59.48.65302: Flags [P.], seq 1234520:1234676, ack 613, win 4063, length 156
03:26:31.156077 IP 159.203.58.6.22 > 69.157.59.48.65302: Flags [P.], seq 1234676:1234832, ack 613, win 4063, length 156
03:26:31.156101 IP 159.203.58.6.22 > 69.157.59.48.65302: Flags [P.], seq 1234832:1234988, ack 613, win 4063, length 156
03:26:31.156126 IP 159.203.58.6.22 > 69.157.59.48.65302: Flags [P.], seq 1234988:1235144, ack 613, win 4063, length 156
03:26:31.156151 IP 159.203.58.6.22 > 69.157.59.48.65302: Flags [P.], seq 1235144:1235300, ack 613, win 4063, length 156
03:26:31.156174 IP 159.203.58.6.22 > 69.157.59.48.65302: Flags [P.], seq 1235300:1235456, ack 613, win 4063, length 156
03:26:31.156202 IP 159.203.58.6.22 > 69.157.59.48.65302: Flags [P.], seq 1235456:1235612, ack 613, win 4063, length 156
03:26:31.156226 IP 159.203.58.6.22 > 69.157.59.48.65302: Flags [P.], seq 1235612:1235768, ack 613, win 4063, length 156
03:26:31.156257 IP 159.203.58.6.22 > 69.157.59.48.65302: Flags [P.], seq 1235768:1235924, ack 613, win 4063, length 156
03:26:31.156281 IP 159.203.58.6.22 > 69.157.59.48.65302: Flags [P.], seq 1235924:1236080, ack 613, win 4063, length 156
03:26:31.156307 IP 159.203.58.6.22 > 69.157.59.48.65302: Flags [P.], seq 1236080:1236236, ack 613, win 4063, length 156
03:26:31.156344 IP 159.203.58.6.22 > 69.157.59.48.65302: Flags [P.], seq 1236236:1236392, ack 613, win 4063, length 156
03:26:31.156392 IP 159.203.58.6.22 > 69.157.59.48.65302: Flags [P.], seq 1236392:1236548, ack 613, win 4063, length 156
03:26:31.156419 IP 159.203.58.6.22 > 69.157.59.48.65302: Flags [P.], seq 1236548:1236704, ack 613, win 4063, length 156
03:26:31.156453 IP 159.203.58.6.22 > 69.157.59.48.65302: Flags [P.], seq 1236704:1236860, ack 613, win 4063, length 156
03:26:31.156481 IP 159.203.58.6.22 > 69.157.59.48.65302: Flags [P.], seq 1236860:1237016, ack 613, win 4063, length 156
03:26:31.156508 IP 159.203.58.6.22 > 69.157.59.48.65302: Flags [P.], seq 1237016:1237172, ack 613, win 4063, length 156
03:26:31.156555 IP 69.157.59.48.65302 > 159.203.58.6.22: Flags [.], ack 1208416, win 2064, length 0
03:26:31.156555 IP 69.157.59.48.65302 > 159.203.58.6.22: Flags [.], ack 1211536, win 2064, length 0
03:26:31.156596 IP 159.203.58.6.22 > 69.157.59.48.65302: Flags [P.], seq 1237172:1237328, ack 613, win 4063, length 156
03:26:31.156611 IP 159.203.58.6.22 > 69.157.59.48.65302: Flags [P.], seq 1237328:1237564, ack 613, win 4063, length 236
03:26:31.156644 IP 159.203.58.6.22 > 69.157.59.48.65302: Flags [P.], seq 1237564:1237840, ack 613, win 4063, length 276
03:26:31.156673 IP 159.203.58.6.22 > 69.157.59.48.65302: Flags [P.], seq 1237840:1237996, ack 613, win 4063, length 156
03:26:31.156702 IP 159.203.58.6.22 > 69.157.59.48.65302: Flags [P.], seq 1237996:1238152, ack 613, win 4063, length 156
03:26:31.156727 IP 159.203.58.6.22 > 69.157.59.48.65302: Flags [P.], seq 1238152:1238308, ack 613, win 4063, length 156
03:26:31.156753 IP 159.203.58.6.22 > 69.157.59.48.65302: Flags [P.], seq 1238308:1238464, ack 613, win 4063, length 156
03:26:31.156778 IP 159.203.58.6.22 > 69.157.59.48.65302: Flags [P.], seq 1238464:1238620, ack 613, win 4063, length 156
03:26:31.156804 IP 159.203.58.6.22 > 69.157.59.48.65302: Flags [P.], seq 1238620:1238776, ack 613, win 4063, length 156
03:26:31.156831 IP 159.203.58.6.22 > 69.157.59.48.65302: Flags [P.], seq 1238776:1238932, ack 613, win 4063, length 156
03:26:31.156856 IP 159.203.58.6.22 > 69.157.59.48.65302: Flags [P.], seq 1238932:1239088, ack 613, win 4063, length 156
03:26:31.156888 IP 159.203.58.6.22 > 69.157.59.48.65302: Flags [P.], seq 1239088:1239244, ack 613, win 4063, length 156
03:26:31.156925 IP 159.203.58.6.22 > 69.157.59.48.65302: Flags [P.], seq 1239244:1239400, ack 613, win 4063, length 156
03:26:31.156952 IP 159.203.58.6.22 > 69.157.59.48.65302: Flags [P.], seq 1239400:1239556, ack 613, win 4063, length 156
03:26:31.156978 IP 159.203.58.6.22 > 69.157.59.48.65302: Flags [P.], seq 1239556:1239712, ack 613, win 4063, length 156
03:26:31.157005 IP 159.203.58.6.22 > 69.157.59.48.65302: Flags [P.], seq 1239712:1239868, ack 613, win 4063, length 156
03:26:31.157031 IP 159.203.58.6.22 > 69.157.59.48.65302: Flags [P.], seq 1239868:1240024, ack 613, win 4063, length 156
03:26:31.157061 IP 159.203.58.6.22 > 69.157.59.48.65302: Flags [P.], seq 1240024:1240180, ack 613, win 4063, length 156
03:26:31.157087 IP 159.203.58.6.22 > 69.157.59.48.65302: Flags [P.], seq 1240180:1240336, ack 613, win 4063, length 156
03:26:31.157113 IP 159.203.58.6.22 > 69.157.59.48.65302: Flags [P.], seq 1240336:1240492, ack 613, win 4063, length 156
03:26:31.157139 IP 159.203.58.6.22 > 69.157.59.48.65302: Flags [P.], seq 1240492:1240648, ack 613, win 4063, length 156
03:26:31.157165 IP 159.203.58.6.22 > 69.157.59.48.65302: Flags [P.], seq 1240648:1240804, ack 613, win 4063, length 156
03:26:31.157190 IP 159.203.58.6.22 > 69.157.59.48.65302: Flags [P.], seq 1240804:1240960, ack 613, win 4063, length 156
03:26:31.157215 IP 159.203.58.6.22 > 69.157.59.48.65302: Flags [P.], seq 1240960:1241116, ack 613, win 4063, length 156
03:26:31.157244 IP 159.203.58.6.22 > 69.157.59.48.65302: Flags [P.], seq 1241116:1241272, ack 613, win 4063, length 156
03:26:31.157272 IP 159.203.58.6.22 > 69.157.59.48.65302: Flags [P.], seq 1241272:1241428, ack 613, win 4063, length 156
03:26:31.157299 IP 159.203.58.6.22 > 69.157.59.48.65302: Flags [P.], seq 1241428:1241584, ack 613, win 4063, length 156
03:26:31.157324 IP 159.203.58.6.22 > 69.157.59.48.65302: Flags [P.], seq 1241584:1241740, ack 613, win 4063, length 156
03:26:31.157357 IP 159.203.58.6.22 > 69.157.59.48.65302: Flags [P.], seq 1241740:1241896, ack 613, win 4063, length 156
03:26:31.157391 IP 159.203.58.6.22 > 69.157.59.48.65302: Flags [P.], seq 1241896:1242052, ack 613, win 4063, length 156
03:26:31.157429 IP 159.203.58.6.22 > 69.157.59.48.65302: Flags [P.], seq 1242052:1242208, ack 613, win 4063, length 156
03:26:31.157457 IP 159.203.58.6.22 > 69.157.59.48.65302: Flags [P.], seq 1242208:1242364, ack 613, win 4063, length 156
03:26:31.157482 IP 159.203.58.6.22 > 69.157.59.48.65302: Flags [P.], seq 1242364:1242520, ack 613, win 4063, length 156
03:26:31.157508 IP 159.203.58.6.22 > 69.157.59.48.65302: Flags [P.], seq 1242520:1242676, ack 613, win 4063, length 156
03:26:31.157535 IP 159.203.58.6.22 > 69.157.59.48.65302: Flags [P.], seq 1242676:1242832, ack 613, win 4063, length 156
03:26:31.157560 IP 159.203.58.6.22 > 69.157.59.48.65302: Flags [P.], seq 1242832:1242988, ack 613, win 4063, length 156
03:26:31.157587 IP 159.203.58.6.22 > 69.157.59.48.65302: Flags [P.], seq 1242988:1243144, ack 613, win 4063, length 156
03:26:31.157613 IP 159.203.58.6.22 > 69.157.59.48.65302: Flags [P.], seq 1243144:1243300, ack 613, win 4063, length 156
03:26:31.157643 IP 159.203.58.6.22 > 69.157.59.48.65302: Flags [P.], seq 1243300:1243456, ack 613, win 4063, length 156
03:26:31.157670 IP 159.203.58.6.22 > 69.157.59.48.65302: Flags [P.], seq 1243456:1243612, ack 613, win 4063, length 156
03:26:31.157697 IP 159.203.58.6.22 > 69.157.59.48.65302: Flags [P.], seq 1243612:1243768, ack 613, win 4063, length 156
03:26:31.157722 IP 159.203.58.6.22 > 69.157.59.48.65302: Flags [P.], seq 1243768:1243924, ack 613, win 4063, length 156
03:26:31.157749 IP 159.203.58.6.22 > 69.157.59.48.65302: Flags [P.], seq 1243924:1244080, ack 613, win 4063, length 156
03:26:31.157773 IP 159.203.58.6.22 > 69.157.59.48.65302: Flags [P.], seq 1244080:1244236, ack 613, win 4063, length 156
03:26:31.157806 IP 159.203.58.6.22 > 69.157.59.48.65302: Flags [P.], seq 1244236:1244392, ack 613, win 4063, length 156
03:26:31.157834 IP 159.203.58.6.22 > 69.157.59.48.65302: Flags [P.], seq 1244392:1244548, ack 613, win 4063, length 156
03:26:31.157859 IP 159.203.58.6.22 > 69.157.59.48.65302: Flags [P.], seq 1244548:1244704, ack 613, win 4063, length 156
03:26:31.157885 IP 159.203.58.6.22 > 69.157.59.48.65302: Flags [P.], seq 1244704:1244860, ack 613, win 4063, length 156
03:26:31.157918 IP 159.203.58.6.22 > 69.157.59.48.65302: Flags [P.], seq 1244860:1245016, ack 613, win 4063, length 156
03:26:31.157944 IP 159.203.58.6.22 > 69.157.59.48.65302: Flags [P.], seq 1245016:1245172, ack 613, win 4063, length 156
03:26:31.157970 IP 159.203.58.6.22 > 69.157.59.48.65302: Flags [P.], seq 1245172:1245328, ack 613, win 4063, length 156
03:26:31.157994 IP 159.203.58.6.22 > 69.157.59.48.65302: Flags [P.], seq 1245328:1245484, ack 613, win 4063, length 156
03:26:31.158026 IP 159.203.58.6.22 > 69.157.59.48.65302: Flags [P.], seq 1245484:1245640, ack 613, win 4063, length 156
03:26:31.158053 IP 159.203.58.6.22 > 69.157.59.48.65302: Flags [P.], seq 1245640:1245796, ack 613, win 4063, length 156
03:26:31.158078 IP 159.203.58.6.22 > 69.157.59.48.65302: Flags [P.], seq 1245796:1245952, ack 613, win 4063, length 156
03:26:31.158105 IP 159.203.58.6.22 > 69.157.59.48.65302: Flags [P.], seq 1245952:1246108, ack 613, win 4063, length 156
03:26:31.158132 IP 159.203.58.6.22 > 69.157.59.48.65302: Flags [P.], seq 1246108:1246264, ack 613, win 4063, length 156
03:26:31.158171 IP 159.203.58.6.22 > 69.157.59.48.65302: Flags [P.], seq 1246264:1246420, ack 613, win 4063, length 156
03:26:31.158196 IP 159.203.58.6.22 > 69.157.59.48.65302: Flags [P.], seq 1246420:1246576, ack 613, win 4063, length 156
03:26:31.158253 IP 159.203.58.6.22 > 69.157.59.48.65302: Flags [P.], seq 1246576:1246732, ack 613, win 4063, length 156
03:26:31.158280 IP 159.203.58.6.22 > 69.157.59.48.65302: Flags [P.], seq 1246732:1246888, ack 613, win 4063, length 156
03:26:31.158306 IP 159.203.58.6.22 > 69.157.59.48.65302: Flags [P.], seq 1246888:1247044, ack 613, win 4063, length 156
03:26:31.158330 IP 159.203.58.6.22 > 69.157.59.48.65302: Flags [P.], seq 1247044:1247200, ack 613, win 4063, length 156
03:26:31.158357 IP 159.203.58.6.22 > 69.157.59.48.65302: Flags [P.], seq 1247200:1247356, ack 613, win 4063, length 156
03:26:31.158384 IP 159.203.58.6.22 > 69.157.59.48.65302: Flags [P.], seq 1247356:1247512, ack 613, win 4063, length 156
03:26:31.158411 IP 159.203.58.6.22 > 69.157.59.48.65302: Flags [P.], seq 1247512:1247668, ack 613, win 4063, length 156
